15:26:06.072377 IP 10.0.0.10.34858 > 10.0.3.10.5201: Flags [S], seq 4135860503, win 42340, options [mss 1460,sackOK,TS val 1571301358 ecr 0,nop,wscale 9], length 0
15:26:06.089484 IP 10.0.3.10.5201 > 10.0.0.10.34858: Flags [S.], seq 1659956516, ack 4135860504, win 43440, options [mss 1460,sackOK,TS val 2654390275 ecr 1571301358,nop,wscale 9], length 0
15:26:06.094828 IP 10.0.0.10.34858 > 10.0.3.10.5201: Flags [.], ack 1, win 83, options [nop,nop,TS val 1571301391 ecr 2654390275], length 0
15:26:06.094852 IP 10.0.0.10.34858 > 10.0.3.10.5201: Flags [P.], seq 1:38, ack 1, win 83, options [nop,nop,TS val 1571301391 ecr 2654390275], length 37
15:26:06.108523 IP 10.0.3.10.5201 > 10.0.0.10.34858: Flags [.], ack 38, win 85, options [nop,nop,TS val 2654390293 ecr 1571301391], length 0
15:26:06.108525 IP 10.0.3.10.5201 > 10.0.0.10.34858: Flags [P.], seq 1:2, ack 38, win 85, options [nop,nop,TS val 2654390294 ecr 1571301391], length 1
15:26:06.119489 IP 10.0.0.10.34858 > 10.0.3.10.5201: Flags [.], ack 2, win 83, options [nop,nop,TS val 1571301410 ecr 2654390294], length 0
15:26:06.119515 IP 10.0.0.10.34858 > 10.0.3.10.5201: Flags [P.], seq 38:42, ack 2, win 83, options [nop,nop,TS val 1571301410 ecr 2654390294], length 4
15:26:06.130447 IP 10.0.3.10.5201 > 10.0.0.10.34858: Flags [.], ack 42, win 85, options [nop,nop,TS val 2654390316 ecr 1571301410], length 0
15:26:06.135978 IP 10.0.0.10.34858 > 10.0.3.10.5201: Flags [P.], seq 42:145, ack 2, win 83, options [nop,nop,TS val 1571301432 ecr 2654390316], length 103
15:26:06.146805 IP 10.0.3.10.5201 > 10.0.0.10.34858: Flags [.], ack 145, win 85, options [nop,nop,TS val 2654390332 ecr 1571301432], length 0
15:26:06.146945 IP 10.0.3.10.5201 > 10.0.0.10.34858: Flags [P.], seq 2:3, ack 145, win 85, options [nop,nop,TS val 2654390333 ecr 1571301432], length 1
15:26:06.152771 IP 10.0.0.10.34858 > 10.0.3.10.5201: Flags [.], ack 3, win 83, options [nop,nop,TS val 1571301449 ecr 2654390333], length 0
15:26:06.152779 IP 10.0.0.10.34866 > 10.0.3.10.5201: Flags [S], seq 2080919138, win 42340, options [mss 1460,sackOK,TS val 1571301449 ecr 0,nop,wscale 9], length 0
15:26:06.166335 IP 10.0.3.10.5201 > 10.0.0.10.34866: Flags [S.], seq 2594474351, ack 2080919139, win 43440, options [mss 1460,sackOK,TS val 2654390350 ecr 1571301449,nop,wscale 9], length 0
15:26:06.171631 IP 10.0.0.10.34866 > 10.0.3.10.5201: Flags [.], ack 1, win 83, options [nop,nop,TS val 1571301468 ecr 2654390350], length 0
15:26:06.171633 IP 10.0.0.10.34866 > 10.0.3.10.5201: Flags [P.], seq 1:38, ack 1, win 83, options [nop,nop,TS val 1571301468 ecr 2654390350], length 37
15:26:06.181904 IP 10.0.3.10.5201 > 10.0.0.10.34866: Flags [.], ack 38, win 85, options [nop,nop,TS val 2654390367 ecr 1571301468], length 0
15:26:06.184397 IP 10.0.3.10.5201 > 10.0.0.10.34858: Flags [P.], seq 3:4, ack 145, win 85, options [nop,nop,TS val 2654390370 ecr 1571301449], length 1
15:26:06.189697 IP 10.0.0.10.34858 > 10.0.3.10.5201: Flags [.], ack 4, win 83, options [nop,nop,TS val 1571301486 ecr 2654390370], length 0
15:26:06.200950 IP 10.0.3.10.5201 > 10.0.0.10.34858: Flags [P.], seq 4:5, ack 145, win 85, options [nop,nop,TS val 2654390387 ecr 1571301486], length 1
15:26:06.206818 IP 10.0.0.10.34858 > 10.0.3.10.5201: Flags [.], ack 5, win 83, options [nop,nop,TS val 1571301503 ecr 2654390387], length 0
15:26:06.206829 IP 10.0.0.10.34866 > 10.0.3.10.5201: Flags [.], seq 38:1486, ack 1, win 83, options [nop,nop,TS val 1571301503 ecr 2654390367], length 1448
15:26:06.206830 IP 10.0.0.10.34866 > 10.0.3.10.5201: Flags [.], seq 1486:2934, ack 1, win 83, options [nop,nop,TS val 1571301503 ecr 2654390367], length 1448
15:26:06.206831 IP 10.0.0.10.34866 > 10.0.3.10.5201: Flags [.], seq 2934:4382, ack 1, win 83, options [nop,nop,TS val 1571301503 ecr 2654390367], length 1448
15:26:06.206832 IP 10.0.0.10.34866 > 10.0.3.10.5201: Flags [.], seq 4382:5830, ack 1, win 83, options [nop,nop,TS val 1571301503 ecr 2654390367], length 1448
15:26:06.206833 IP 10.0.0.10.34866 > 10.0.3.10.5201: Flags [.], seq 5830:7278, ack 1, win 83, options [nop,nop,TS val 1571301503 ecr 2654390367], length 1448
15:26:06.206834 IP 10.0.0.10.34866 > 10.0.3.10.5201: Flags [.], seq 7278:8726, ack 1, win 83, options [nop,nop,TS val 1571301503 ecr 2654390367], length 1448
15:26:06.206835 IP 10.0.0.10.34866 > 10.0.3.10.5201: Flags [.], seq 8726:10174, ack 1, win 83, options [nop,nop,TS val 1571301503 ecr 2654390367], length 1448
15:26:06.206836 IP 10.0.0.10.34866 > 10.0.3.10.5201: Flags [.], seq 10174:11622, ack 1, win 83, options [nop,nop,TS val 1571301503 ecr 2654390367], length 1448
15:26:06.207833 IP 10.0.0.10.34866 > 10.0.3.10.5201: Flags [.], seq 11622:13070, ack 1, win 83, options [nop,nop,TS val 1571301503 ecr 2654390367], length 1448
15:26:06.207836 IP 10.0.0.10.34866 > 10.0.3.10.5201: Flags [.], seq 13070:14518, ack 1, win 83, options [nop,nop,TS val 1571301503 ecr 2654390367], length 1448
15:26:06.217252 IP 10.0.3.10.5201 > 10.0.0.10.34866: Flags [.], ack 1486, win 83, options [nop,nop,TS val 2654390403 ecr 1571301503], length 0
15:26:06.217253 IP 10.0.3.10.5201 > 10.0.0.10.34866: Flags [.], ack 2934, win 82, options [nop,nop,TS val 2654390403 ecr 1571301503], length 0
15:26:06.217254 IP 10.0.3.10.5201 > 10.0.0.10.34866: Flags [.], ack 4382, win 80, options [nop,nop,TS val 2654390403 ecr 1571301503], length 0
15:26:06.217267 IP 10.0.3.10.5201 > 10.0.0.10.34866: Flags [.], ack 5830, win 79, options [nop,nop,TS val 2654390403 ecr 1571301503], length 0
15:26:06.217268 IP 10.0.3.10.5201 > 10.0.0.10.34866: Flags [.], ack 7278, win 78, options [nop,nop,TS val 2654390403 ecr 1571301503], length 0
15:26:06.217268 IP 10.0.3.10.5201 > 10.0.0.10.34866: Flags [.], ack 8726, win 76, options [nop,nop,TS val 2654390403 ecr 1571301503], length 0
15:26:06.217269 IP 10.0.3.10.5201 > 10.0.0.10.34866: Flags [.], ack 10174, win 75, options [nop,nop,TS val 2654390403 ecr 1571301503], length 0
15:26:06.217269 IP 10.0.3.10.5201 > 10.0.0.10.34866: Flags [.], ack 11622, win 73, options [nop,nop,TS val 2654390403 ecr 1571301503], length 0
15:26:06.223065 IP 10.0.0.10.34866 > 10.0.3.10.5201: Flags [.], seq 14518:15966, ack 1, win 83, options [nop,nop,TS val 1571301519 ecr 2654390403], length 1448
15:26:06.223067 IP 10.0.0.10.34866 > 10.0.3.10.5201: Flags [.], seq 15966:17414, ack 1, win 83, options [nop,nop,TS val 1571301519 ecr 2654390403], length 1448
15:26:06.223076 IP 10.0.0.10.34866 > 10.0.3.10.5201: Flags [.], seq 17414:18862, ack 1, win 83, options [nop,nop,TS val 1571301519 ecr 2654390403], length 1448
15:26:06.223077 IP 10.0.0.10.34866 > 10.0.3.10.5201: Flags [.], seq 18862:20310, ack 1, win 83, options [nop,nop,TS val 1571301519 ecr 2654390403], length 1448
15:26:06.223079 IP 10.0.0.10.34866 > 10.0.3.10.5201: Flags [.], seq 20310:21758, ack 1, win 83, options [nop,nop,TS val 1571301519 ecr 2654390403], length 1448
15:26:06.223079 IP 10.0.0.10.34866 > 10.0.3.10.5201: Flags [.], seq 21758:23206, ack 1, win 83, options [nop,nop,TS val 1571301519 ecr 2654390403], length 1448
15:26:06.223080 IP 10.0.0.10.34866 > 10.0.3.10.5201: Flags [.], seq 23206:24654, ack 1, win 83, options [nop,nop,TS val 1571301519 ecr 2654390403], length 1448
15:26:06.223081 IP 10.0.0.10.34866 > 10.0.3.10.5201: Flags [.], seq 24654:26102, ack 1, win 83, options [nop,nop,TS val 1571301519 ecr 2654390403], length 1448
15:26:06.223082 IP 10.0.0.10.34866 > 10.0.3.10.5201: Flags [.], seq 26102:27550, ack 1, win 83, options [nop,nop,TS val 1571301519 ecr 2654390403], length 1448
15:26:06.223083 IP 10.0.0.10.34866 > 10.0.3.10.5201: Flags [.], seq 27550:28998, ack 1, win 83, options [nop,nop,TS val 1571301519 ecr 2654390403], length 1448
15:26:06.226893 IP 10.0.3.10.5201 > 10.0.0.10.34866: Flags [.], ack 13070, win 83, options [nop,nop,TS val 2654390412 ecr 1571301503], length 0
15:26:06.226962 IP 10.0.0.10.34866 > 10.0.3.10.5201: Flags [.], seq 28998:30446, ack 1, win 83, options [nop,nop,TS val 1571301519 ecr 2654390403], length 1448
15:26:06.226965 IP 10.0.0.10.34866 > 10.0.3.10.5201: Flags [.], seq 30446:31894, ack 1, win 83, options [nop,nop,TS val 1571301519 ecr 2654390403], length 1448
15:26:06.227076 IP 10.0.0.10.34866 > 10.0.3.10.5201: Flags [.], seq 31894:33342, ack 1, win 83, options [nop,nop,TS val 1571301519 ecr 2654390403], length 1448
15:26:06.227078 IP 10.0.0.10.34866 > 10.0.3.10.5201: Flags [.], seq 33342:34790, ack 1, win 83, options [nop,nop,TS val 1571301519 ecr 2654390403], length 1448
15:26:06.227079 IP 10.0.0.10.34866 > 10.0.3.10.5201: Flags [P.], seq 34790:36238, ack 1, win 83, options [nop,nop,TS val 1571301519 ecr 2654390403], length 1448
15:26:06.230928 IP 10.0.3.10.5201 > 10.0.0.10.34866: Flags [.], ack 14518, win 83, options [nop,nop,TS val 2654390414 ecr 1571301503], length 0
15:26:06.232812 IP 10.0.0.10.34866 > 10.0.3.10.5201: Flags [.], seq 36238:37686, ack 1, win 83, options [nop,nop,TS val 1571301529 ecr 2654390412], length 1448
15:26:06.232814 IP 10.0.0.10.34866 > 10.0.3.10.5201: Flags [.], seq 37686:39134, ack 1, win 83, options [nop,nop,TS val 1571301529 ecr 2654390412], length 1448
15:26:06.236033 IP 10.0.0.10.34866 > 10.0.3.10.5201: Flags [.], seq 39134:40582, ack 1, win 83, options [nop,nop,TS val 1571301533 ecr 2654390414], length 1448
15:26:06.236038 IP 10.0.0.10.34866 > 10.0.3.10.5201: Flags [.], seq 40582:42030, ack 1, win 83, options [nop,nop,TS val 1571301533 ecr 2654390414], length 1448
15:26:06.243599 IP 10.0.3.10.5201 > 10.0.0.10.34866: Flags [.], ack 15966, win 83, options [nop,nop,TS val 2654390429 ecr 1571301519], length 0
15:26:06.246472 IP 10.0.3.10.5201 > 10.0.0.10.34866: Flags [.], ack 17414, win 83, options [nop,nop,TS val 2654390431 ecr 1571301519], length 0
15:26:06.249349 IP 10.0.3.10.5201 > 10.0.0.10.34866: Flags [.], ack 18862, win 83, options [nop,nop,TS val 2654390434 ecr 1571301519], length 0
15:26:06.249403 IP 10.0.0.10.34866 > 10.0.3.10.5201: Flags [.], seq 42030:43478, ack 1, win 83, options [nop,nop,TS val 1571301545 ecr 2654390429], length 1448
15:26:06.249405 IP 10.0.0.10.34866 > 10.0.3.10.5201: Flags [.], seq 43478:44926, ack 1, win 83, options [nop,nop,TS val 1571301545 ecr 2654390429], length 1448
15:26:06.249547 IP 10.0.3.10.5201 > 10.0.0.10.34866: Flags [.], ack 20310, win 83, options [nop,nop,TS val 2654390435 ecr 1571301519], length 0
15:26:06.251282 IP 10.0.3.10.5201 > 10.0.0.10.34866: Flags [.], ack 21758, win 83, options [nop,nop,TS val 2654390436 ecr 1571301519], length 0
15:26:06.252760 IP 10.0.0.10.34866 > 10.0.3.10.5201: Flags [.], seq 44926:46374, ack 1, win 83, options [nop,nop,TS val 1571301548 ecr 2654390431], length 1448
15:26:06.252765 IP 10.0.0.10.34866 > 10.0.3.10.5201: Flags [.], seq 46374:47822, ack 1, win 83, options [nop,nop,TS val 1571301548 ecr 2654390431], length 1448
15:26:06.253478 IP 10.0.3.10.5201 > 10.0.0.10.34866: Flags [.], ack 24654, win 83, options [nop,nop,TS val 2654390439 ecr 1571301519], length 0
15:26:06.255372 IP 10.0.3.10.5201 > 10.0.0.10.34866: Flags [.], ack 27550, win 83, options [nop,nop,TS val 2654390441 ecr 1571301519], length 0
15:26:06.255382 IP 10.0.0.10.34866 > 10.0.3.10.5201: Flags [.], seq 47822:49270, ack 1, win 83, options [nop,nop,TS val 1571301551 ecr 2654390434], length 1448
15:26:06.255384 IP 10.0.0.10.34866 > 10.0.3.10.5201: Flags [.], seq 49270:50718, ack 1, win 83, options [nop,nop,TS val 1571301551 ecr 2654390434], length 1448
15:26:06.255385 IP 10.0.0.10.34866 > 10.0.3.10.5201: Flags [.], seq 50718:52166, ack 1, win 83, options [nop,nop,TS val 1571301551 ecr 2654390435], length 1448
15:26:06.255386 IP 10.0.0.10.34866 > 10.0.3.10.5201: Flags [.], seq 52166:53614, ack 1, win 83, options [nop,nop,TS val 1571301551 ecr 2654390435], length 1448
15:26:06.256370 IP 10.0.0.10.34866 > 10.0.3.10.5201: Flags [.], seq 53614:55062, ack 1, win 83, options [nop,nop,TS val 1571301553 ecr 2654390436], length 1448
15:26:06.256374 IP 10.0.0.10.34866 > 10.0.3.10.5201: Flags [.], seq 55062:56510, ack 1, win 83, options [nop,nop,TS val 1571301553 ecr 2654390436], length 1448
15:26:06.256375 IP 10.0.0.10.34866 > 10.0.3.10.5201: Flags [P.], seq 56510:57958, ack 1, win 83, options [nop,nop,TS val 1571301553 ecr 2654390436], length 1448
15:26:06.258222 IP 10.0.3.10.5201 > 10.0.0.10.34866: Flags [.], ack 30446, win 83, options [nop,nop,TS val 2654390443 ecr 1571301519], length 0
15:26:06.260408 IP 10.0.0.10.34866 > 10.0.3.10.5201: Flags [.], seq 57958:59406, ack 1, win 83, options [nop,nop,TS val 1571301555 ecr 2654390439], length 1448
15:26:06.260410 IP 10.0.0.10.34866 > 10.0.3.10.5201: Flags [.], seq 59406:60854, ack 1, win 83, options [nop,nop,TS val 1571301555 ecr 2654390439], length 1448
15:26:06.260412 IP 10.0.0.10.34866 > 10.0.3.10.5201: Flags [.], seq 60854:62302, ack 1, win 83, options [nop,nop,TS val 1571301555 ecr 2654390439], length 1448
15:26:06.260413 IP 10.0.0.10.34866 > 10.0.3.10.5201: Flags [.], seq 62302:63750, ack 1, win 83, options [nop,nop,TS val 1571301555 ecr 2654390439], length 1448
15:26:06.260499 IP 10.0.0.10.34866 > 10.0.3.10.5201: Flags [.], seq 63750:65198, ack 1, win 83, options [nop,nop,TS val 1571301557 ecr 2654390441], length 1448
15:26:06.260504 IP 10.0.0.10.34866 > 10.0.3.10.5201: Flags [.], seq 65198:66646, ack 1, win 83, options [nop,nop,TS val 1571301557 ecr 2654390441], length 1448
15:26:06.260505 IP 10.0.0.10.34866 > 10.0.3.10.5201: Flags [.], seq 66646:68094, ack 1, win 83, options [nop,nop,TS val 1571301557 ecr 2654390441], length 1448
15:26:06.260505 IP 10.0.0.10.34866 > 10.0.3.10.5201: Flags [.], seq 68094:69542, ack 1, win 83, options [nop,nop,TS val 1571301557 ecr 2654390441], length 1448
15:26:06.263277 IP 10.0.3.10.5201 > 10.0.0.10.34866: Flags [.], ack 33342, win 83, options [nop,nop,TS val 2654390449 ecr 1571301519], length 0
15:26:06.263278 IP 10.0.0.10.34866 > 10.0.3.10.5201: Flags [.], seq 69542:70990, ack 1, win 83, options [nop,nop,TS val 1571301560 ecr 2654390443], length 1448
15:26:06.263282 IP 10.0.0.10.34866 > 10.0.3.10.5201: Flags [.], seq 70990:72438, ack 1, win 83, options [nop,nop,TS val 1571301560 ecr 2654390443], length 1448
15:26:06.266211 IP 10.0.3.10.5201 > 10.0.0.10.34866: Flags [.], ack 34790, win 89, options [nop,nop,TS val 2654390451 ecr 1571301519], length 0
15:26:06.266216 IP 10.0.3.10.5201 > 10.0.0.10.34866: Flags [.], ack 36238, win 94, options [nop,nop,TS val 2654390451 ecr 1571301519], length 0
15:26:06.268730 IP 10.0.0.10.34866 > 10.0.3.10.5201: Flags [.], seq 72438:73886, ack 1, win 83, options [nop,nop,TS val 1571301565 ecr 2654390449], length 1448
15:26:06.268741 IP 10.0.0.10.34866 > 10.0.3.10.5201: Flags [.], seq 73886:75334, ack 1, win 83, options [nop,nop,TS val 1571301565 ecr 2654390449], length 1448
15:26:06.271760 IP 10.0.0.10.34866 > 10.0.3.10.5201: Flags [.], seq 75334:76782, ack 1, win 83, options [nop,nop,TS val 1571301568 ecr 2654390451], length 1448
15:26:06.271775 IP 10.0.0.10.34866 > 10.0.3.10.5201: Flags [.], seq 76782:78230, ack 1, win 83, options [nop,nop,TS val 1571301568 ecr 2654390451], length 1448
15:26:06.271878 IP 10.0.0.10.34866 > 10.0.3.10.5201: Flags [P.], seq 78230:79678, ack 1, win 83, options [nop,nop,TS val 1571301568 ecr 2654390451], length 1448
15:26:06.271884 IP 10.0.0.10.34866 > 10.0.3.10.5201: Flags [.], seq 79678:81126, ack 1, win 83, options [nop,nop,TS val 1571301568 ecr 2654390451], length 1448
15:26:06.271887 IP 10.0.0.10.34866 > 10.0.3.10.5201: Flags [.], seq 81126:82574, ack 1, win 83, options [nop,nop,TS val 1571301568 ecr 2654390451], length 1448
15:26:06.278755 IP 10.0.3.10.5201 > 10.0.0.10.34866: Flags [.], ack 37686, win 100, options [nop,nop,TS val 2654390464 ecr 1571301529], length 0
15:26:06.279759 IP 10.0.3.10.5201 > 10.0.0.10.34866: Flags [.], ack 39134, win 106, options [nop,nop,TS val 2654390465 ecr 1571301529], length 0
15:26:06.282052 IP 10.0.3.10.5201 > 10.0.0.10.34866: Flags [.], ack 40582, win 111, options [nop,nop,TS val 2654390468 ecr 1571301533], length 0
15:26:06.284769 IP 10.0.3.10.5201 > 10.0.0.10.34866: Flags [.], ack 42030, win 117, options [nop,nop,TS val 2654390469 ecr 1571301533], length 0
15:26:06.284923 IP 10.0.0.10.34866 > 10.0.3.10.5201: Flags [.], seq 82574:84022, ack 1, win 83, options [nop,nop,TS val 1571301580 ecr 2654390464], length 1448
15:26:06.284933 IP 10.0.0.10.34866 > 10.0.3.10.5201: Flags [.], seq 84022:85470, ack 1, win 83, options [nop,nop,TS val 1571301580 ecr 2654390464], length 1448
15:26:06.284962 IP 10.0.0.10.34866 > 10.0.3.10.5201: Flags [.], seq 85470:86918, ack 1, win 83, options [nop,nop,TS val 1571301582 ecr 2654390465], length 1448
15:26:06.287322 IP 10.0.0.10.34866 > 10.0.3.10.5201: Flags [.], seq 86918:88366, ack 1, win 83, options [nop,nop,TS val 1571301584 ecr 2654390468], length 1448
15:26:06.290207 IP 10.0.0.10.34866 > 10.0.3.10.5201: Flags [.], seq 88366:89814, ack 1, win 83, options [nop,nop,TS val 1571301587 ecr 2654390469], length 1448
15:26:06.314580 IP 10.0.3.10.5201 > 10.0.0.10.34866: Flags [.], ack 43478, win 123, options [nop,nop,TS val 2654390500 ecr 1571301545], length 0
15:26:06.314582 IP 10.0.3.10.5201 > 10.0.0.10.34866: Flags [.], ack 44926, win 128, options [nop,nop,TS val 2654390500 ecr 1571301545], length 0
15:26:06.316932 IP 10.0.3.10.5201 > 10.0.0.10.34866: Flags [.], ack 46374, win 134, options [nop,nop,TS val 2654390502 ecr 1571301548], length 0
15:26:06.318062 IP 10.0.3.10.5201 > 10.0.0.10.34866: Flags [.], ack 47822, win 140, options [nop,nop,TS val 2654390503 ecr 1571301548], length 0
15:26:06.319938 IP 10.0.3.10.5201 > 10.0.0.10.34866: Flags [.], ack 49270, win 145, options [nop,nop,TS val 2654390505 ecr 1571301551], length 0
15:26:06.319971 IP 10.0.0.10.34866 > 10.0.3.10.5201: Flags [.], seq 89814:91262, ack 1, win 83, options [nop,nop,TS val 1571301616 ecr 2654390500], length 1448
15:26:06.321170 IP 10.0.3.10.5201 > 10.0.0.10.34866: Flags [.], ack 50718, win 151, options [nop,nop,TS val 2654390507 ecr 1571301551], length 0
15:26:06.322053 IP 10.0.3.10.5201 > 10.0.0.10.34866: Flags [.], ack 52166, win 157, options [nop,nop,TS val 2654390508 ecr 1571301551], length 0
15:26:06.322060 IP 10.0.0.10.34866 > 10.0.3.10.5201: Flags [.], seq 91262:92710, ack 1, win 83, options [nop,nop,TS val 1571301619 ecr 2654390502], length 1448
15:26:06.322068 IP 10.0.0.10.34866 > 10.0.3.10.5201: Flags [.], seq 92710:94158, ack 1, win 83, options [nop,nop,TS val 1571301619 ecr 2654390502], length 1448
15:26:06.323212 IP 10.0.3.10.5201 > 10.0.0.10.34866: Flags [.], ack 53614, win 162, options [nop,nop,TS val 2654390509 ecr 1571301551], length 0
15:26:06.323219 IP 10.0.0.10.34866 > 10.0.3.10.5201: Flags [.], seq 94158:95606, ack 1, win 83, options [nop,nop,TS val 1571301620 ecr 2654390503], length 1448
15:26:06.331623 IP 10.0.3.10.5201 > 10.0.0.10.34866: Flags [.], ack 55062, win 168, options [nop,nop,TS val 2654390511 ecr 1571301553], length 0
15:26:06.331656 IP 10.0.3.10.5201 > 10.0.0.10.34866: Flags [.], ack 56510, win 173, options [nop,nop,TS val 2654390511 ecr 1571301553], length 0
15:26:06.331657 IP 10.0.3.10.5201 > 10.0.0.10.34866: Flags [.], ack 57958, win 179, options [nop,nop,TS val 2654390512 ecr 1571301553], length 0
15:26:06.331658 IP 10.0.3.10.5201 > 10.0.0.10.34866: Flags [.], ack 59406, win 185, options [nop,nop,TS val 2654390513 ecr 1571301555], length 0
15:26:06.331687 IP 10.0.0.10.34866 > 10.0.3.10.5201: Flags [.], seq 95606:97054, ack 1, win 83, options [nop,nop,TS val 1571301622 ecr 2654390505], length 1448
15:26:06.331759 IP 10.0.0.10.34866 > 10.0.3.10.5201: Flags [.], seq 97054:98502, ack 1, win 83, options [nop,nop,TS val 1571301623 ecr 2654390507], length 1448
15:26:06.331763 IP 10.0.0.10.34866 > 10.0.3.10.5201: Flags [.], seq 98502:99950, ack 1, win 83, options [nop,nop,TS val 1571301625 ecr 2654390509], length 1448
15:26:06.331765 IP 10.0.0.10.34866 > 10.0.3.10.5201: Flags [.], seq 99950:101398, ack 1, win 83, options [nop,nop,TS val 1571301625 ecr 2654390509], length 1448
15:26:06.337099 IP 10.0.0.10.34866 > 10.0.3.10.5201: Flags [.], seq 101398:102846, ack 1, win 83, options [nop,nop,TS val 1571301633 ecr 2654390511], length 1448
15:26:06.337123 IP 10.0.3.10.5201 > 10.0.0.10.34866: Flags [.], ack 69542, win 220, options [nop,nop,TS val 2654390522 ecr 1571301557], length 0
15:26:06.337125 IP 10.0.3.10.5201 > 10.0.0.10.34866: Flags [.], ack 60854, win 190, options [nop,nop,TS val 2654390522 ecr 1571301555], length 0
15:26:06.337126 IP 10.0.3.10.5201 > 10.0.0.10.34866: Flags [.], ack 62302, win 196, options [nop,nop,TS val 2654390522 ecr 1571301555], length 0
15:26:06.337128 IP 10.0.3.10.5201 > 10.0.0.10.34866: Flags [.], ack 63750, win 202, options [nop,nop,TS val 2654390522 ecr 1571301555], length 0
15:26:06.337129 IP 10.0.3.10.5201 > 10.0.0.10.34866: Flags [.], ack 65198, win 207, options [nop,nop,TS val 2654390522 ecr 1571301557], length 0
15:26:06.337130 IP 10.0.3.10.5201 > 10.0.0.10.34866: Flags [.], ack 66646, win 213, options [nop,nop,TS val 2654390522 ecr 1571301557], length 0
15:26:06.337138 IP 10.0.0.10.34866 > 10.0.3.10.5201: Flags [.], seq 102846:104294, ack 1, win 83, options [nop,nop,TS val 1571301633 ecr 2654390512], length 1448
15:26:06.337143 IP 10.0.0.10.34866 > 10.0.3.10.5201: Flags [.], seq 104294:105742, ack 1, win 83, options [nop,nop,TS val 1571301633 ecr 2654390512], length 1448
15:26:06.337648 IP 10.0.3.10.5201 > 10.0.0.10.34866: Flags [.], ack 70990, win 225, options [nop,nop,TS val 2654390523 ecr 1571301560], length 0
15:26:06.342241 IP 10.0.3.10.5201 > 10.0.0.10.34866: Flags [.], ack 73886, win 225, options [nop,nop,TS val 2654390527 ecr 1571301560], length 0
15:26:06.342301 IP 10.0.0.10.34866 > 10.0.3.10.5201: Flags [.], seq 105742:107190, ack 1, win 83, options [nop,nop,TS val 1571301639 ecr 2654390522], length 1448
15:26:06.342308 IP 10.0.0.10.34866 > 10.0.3.10.5201: Flags [.], seq 107190:108638, ack 1, win 83, options [nop,nop,TS val 1571301639 ecr 2654390522], length 1448
15:26:06.342309 IP 10.0.0.10.34866 > 10.0.3.10.5201: Flags [.], seq 108638:110086, ack 1, win 83, options [nop,nop,TS val 1571301639 ecr 2654390522], length 1448
15:26:06.342311 IP 10.0.0.10.34866 > 10.0.3.10.5201: Flags [.], seq 110086:111534, ack 1, win 83, options [nop,nop,TS val 1571301639 ecr 2654390522], length 1448
15:26:06.342313 IP 10.0.0.10.34866 > 10.0.3.10.5201: Flags [.], seq 111534:112982, ack 1, win 83, options [nop,nop,TS val 1571301639 ecr 2654390522], length 1448
15:26:06.342314 IP 10.0.0.10.34866 > 10.0.3.10.5201: Flags [.], seq 112982:114430, ack 1, win 83, options [nop,nop,TS val 1571301639 ecr 2654390522], length 1448
15:26:06.342316 IP 10.0.0.10.34866 > 10.0.3.10.5201: Flags [.], seq 114430:115878, ack 1, win 83, options [nop,nop,TS val 1571301639 ecr 2654390522], length 1448
15:26:06.342317 IP 10.0.0.10.34866 > 10.0.3.10.5201: Flags [.], seq 115878:117326, ack 1, win 83, options [nop,nop,TS val 1571301639 ecr 2654390522], length 1448
15:26:06.343280 IP 10.0.0.10.34866 > 10.0.3.10.5201: Flags [.], seq 117326:118774, ack 1, win 83, options [nop,nop,TS val 1571301639 ecr 2654390523], length 1448
15:26:06.343291 IP 10.0.0.10.34866 > 10.0.3.10.5201: Flags [.], seq 118774:120222, ack 1, win 83, options [nop,nop,TS val 1571301639 ecr 2654390523], length 1448
15:26:06.345221 IP 10.0.3.10.5201 > 10.0.0.10.34866: Flags [.], ack 76782, win 225, options [nop,nop,TS val 2654390530 ecr 1571301565], length 0
15:26:06.347340 IP 10.0.0.10.34866 > 10.0.3.10.5201: Flags [.], seq 120222:121670, ack 1, win 83, options [nop,nop,TS val 1571301644 ecr 2654390527], length 1448
15:26:06.347347 IP 10.0.0.10.34866 > 10.0.3.10.5201: Flags [P.], seq 121670:123118, ack 1, win 83, options [nop,nop,TS val 1571301644 ecr 2654390527], length 1448
15:26:06.349069 IP 10.0.3.10.5201 > 10.0.0.10.34866: Flags [.], ack 79678, win 225, options [nop,nop,TS val 2654390534 ecr 1571301568], length 0
15:26:06.351243 IP 10.0.3.10.5201 > 10.0.0.10.34866: Flags [.], ack 82574, win 225, options [nop,nop,TS val 2654390537 ecr 1571301568], length 0
15:26:06.351246 IP 10.0.0.10.34866 > 10.0.3.10.5201: Flags [.], seq 123118:124566, ack 1, win 83, options [nop,nop,TS val 1571301647 ecr 2654390530], length 1448
15:26:06.351256 IP 10.0.0.10.34866 > 10.0.3.10.5201: Flags [.], seq 124566:126014, ack 1, win 83, options [nop,nop,TS val 1571301647 ecr 2654390530], length 1448
15:26:06.354659 IP 10.0.0.10.34866 > 10.0.3.10.5201: Flags [.], seq 126014:127462, ack 1, win 83, options [nop,nop,TS val 1571301651 ecr 2654390534], length 1448
15:26:06.354692 IP 10.0.0.10.34866 > 10.0.3.10.5201: Flags [.], seq 127462:128910, ack 1, win 83, options [nop,nop,TS val 1571301651 ecr 2654390534], length 1448
15:26:06.356929 IP 10.0.0.10.34866 > 10.0.3.10.5201: Flags [.], seq 128910:130358, ack 1, win 83, options [nop,nop,TS val 1571301653 ecr 2654390537], length 1448
15:26:06.356933 IP 10.0.0.10.34866 > 10.0.3.10.5201: Flags [.], seq 130358:131806, ack 1, win 83, options [nop,nop,TS val 1571301653 ecr 2654390537], length 1448
15:26:06.362814 IP 10.0.3.10.5201 > 10.0.0.10.34866: Flags [.], ack 85470, win 225, options [nop,nop,TS val 2654390548 ecr 1571301580], length 0
15:26:06.367897 IP 10.0.3.10.5201 > 10.0.0.10.34866: Flags [.], ack 88366, win 225, options [nop,nop,TS val 2654390554 ecr 1571301582], length 0
15:26:06.367913 IP 10.0.0.10.34866 > 10.0.3.10.5201: Flags [.], seq 131806:133254, ack 1, win 83, options [nop,nop,TS val 1571301665 ecr 2654390548], length 1448
15:26:06.367915 IP 10.0.0.10.34866 > 10.0.3.10.5201: Flags [.], seq 133254:134702, ack 1, win 83, options [nop,nop,TS val 1571301665 ecr 2654390548], length 1448
15:26:06.372969 IP 10.0.0.10.34866 > 10.0.3.10.5201: Flags [.], seq 134702:136150, ack 1, win 83, options [nop,nop,TS val 1571301670 ecr 2654390554], length 1448
15:26:06.372971 IP 10.0.0.10.34866 > 10.0.3.10.5201: Flags [.], seq 136150:137598, ack 1, win 83, options [nop,nop,TS val 1571301670 ecr 2654390554], length 1448
15:26:06.409805 IP 10.0.3.10.5201 > 10.0.0.10.34866: Flags [.], ack 91262, win 225, options [nop,nop,TS val 2654390595 ecr 1571301587], length 0
15:26:06.411762 IP 10.0.3.10.5201 > 10.0.0.10.34866: Flags [.], ack 92710, win 231, options [nop,nop,TS val 2654390596 ecr 1571301619], length 0
15:26:06.411763 IP 10.0.3.10.5201 > 10.0.0.10.34866: Flags [.], ack 94158, win 236, options [nop,nop,TS val 2654390597 ecr 1571301619], length 0
15:26:06.415656 IP 10.0.3.10.5201 > 10.0.0.10.34866: Flags [.], ack 95606, win 242, options [nop,nop,TS val 2654390599 ecr 1571301620], length 0
15:26:06.415657 IP 10.0.3.10.5201 > 10.0.0.10.34866: Flags [.], ack 97054, win 248, options [nop,nop,TS val 2654390601 ecr 1571301622], length 0
15:26:06.415658 IP 10.0.3.10.5201 > 10.0.0.10.34866: Flags [.], ack 98502, win 253, options [nop,nop,TS val 2654390601 ecr 1571301623], length 0
15:26:06.415699 IP 10.0.0.10.34866 > 10.0.3.10.5201: Flags [.], seq 137598:139046, ack 1, win 83, options [nop,nop,TS val 1571301712 ecr 2654390595], length 1448
15:26:06.415700 IP 10.0.0.10.34866 > 10.0.3.10.5201: Flags [.], seq 139046:140494, ack 1, win 83, options [nop,nop,TS val 1571301712 ecr 2654390595], length 1448
15:26:06.417622 IP 10.0.3.10.5201 > 10.0.0.10.34866: Flags [.], ack 99950, win 259, options [nop,nop,TS val 2654390602 ecr 1571301625], length 0
15:26:06.417636 IP 10.0.0.10.34866 > 10.0.3.10.5201: Flags [.], seq 140494:141942, ack 1, win 83, options [nop,nop,TS val 1571301713 ecr 2654390596], length 1448
15:26:06.417675 IP 10.0.0.10.34866 > 10.0.3.10.5201: Flags [.], seq 141942:143390, ack 1, win 83, options [nop,nop,TS val 1571301713 ecr 2654390596], length 1448
15:26:06.417677 IP 10.0.0.10.34866 > 10.0.3.10.5201: Flags [.], seq 143390:144838, ack 1, win 83, options [nop,nop,TS val 1571301713 ecr 2654390597], length 1448
15:26:06.417715 IP 10.0.3.10.5201 > 10.0.0.10.34866: Flags [.], ack 101398, win 265, options [nop,nop,TS val 2654390603 ecr 1571301625], length 0
15:26:06.421458 IP 10.0.3.10.5201 > 10.0.0.10.34866: Flags [.], ack 102846, win 270, options [nop,nop,TS val 2654390606 ecr 1571301633], length 0
15:26:06.421459 IP 10.0.3.10.5201 > 10.0.0.10.34866: Flags [.], ack 104294, win 276, options [nop,nop,TS val 2654390606 ecr 1571301633], length 0
15:26:06.421465 IP 10.0.0.10.34866 > 10.0.3.10.5201: Flags [.], seq 144838:146286, ack 1, win 83, options [nop,nop,TS val 1571301717 ecr 2654390599], length 1448
15:26:06.421470 IP 10.0.0.10.34866 > 10.0.3.10.5201: Flags [.], seq 146286:147734, ack 1, win 83, options [nop,nop,TS val 1571301717 ecr 2654390601], length 1448
15:26:06.421471 IP 10.0.0.10.34866 > 10.0.3.10.5201: Flags [.], seq 147734:149182, ack 1, win 83, options [nop,nop,TS val 1571301717 ecr 2654390601], length 1448
15:26:06.423415 IP 10.0.3.10.5201 > 10.0.0.10.34866: Flags [.], ack 105742, win 282, options [nop,nop,TS val 2654390608 ecr 1571301633], length 0
15:26:06.423416 IP 10.0.3.10.5201 > 10.0.0.10.34866: Flags [.], ack 107190, win 287, options [nop,nop,TS val 2654390608 ecr 1571301639], length 0
15:26:06.423419 IP 10.0.0.10.34866 > 10.0.3.10.5201: Flags [.], seq 149182:150630, ack 1, win 83, options [nop,nop,TS val 1571301719 ecr 2654390602], length 1448
15:26:06.423548 IP 10.0.3.10.5201 > 10.0.0.10.34866: Flags [.], ack 108638, win 293, options [nop,nop,TS val 2654390609 ecr 1571301639], length 0
15:26:06.427294 IP 10.0.3.10.5201 > 10.0.0.10.34866: Flags [.], ack 110086, win 299, options [nop,nop,TS val 2654390610 ecr 1571301639], length 0
15:26:06.427315 IP 10.0.3.10.5201 > 10.0.0.10.34866: Flags [.], ack 111534, win 304, options [nop,nop,TS val 2654390612 ecr 1571301639], length 0
15:26:06.427342 IP 10.0.0.10.34866 > 10.0.3.10.5201: Flags [.], seq 150630:152078, ack 1, win 83, options [nop,nop,TS val 1571301723 ecr 2654390606], length 1448
15:26:06.427345 IP 10.0.0.10.34866 > 10.0.3.10.5201: Flags [.], seq 152078:153526, ack 1, win 83, options [nop,nop,TS val 1571301723 ecr 2654390606], length 1448
15:26:06.430310 IP 10.0.3.10.5201 > 10.0.0.10.34866: Flags [.], ack 112982, win 310, options [nop,nop,TS val 2654390613 ecr 1571301639], length 0
15:26:06.430331 IP 10.0.3.10.5201 > 10.0.0.10.34866: Flags [.], ack 114430, win 316, options [nop,nop,TS val 2654390614 ecr 1571301639], length 0
15:26:06.430350 IP 10.0.0.10.34866 > 10.0.3.10.5201: Flags [.], seq 153526:154974, ack 1, win 83, options [nop,nop,TS val 1571301725 ecr 2654390608], length 1448
15:26:06.430352 IP 10.0.0.10.34866 > 10.0.3.10.5201: Flags [.], seq 154974:156422, ack 1, win 83, options [nop,nop,TS val 1571301725 ecr 2654390608], length 1448
15:26:06.430360 IP 10.0.0.10.34866 > 10.0.3.10.5201: Flags [.], seq 156422:157870, ack 1, win 83, options [nop,nop,TS val 1571301725 ecr 2654390609], length 1448
15:26:06.430361 IP 10.0.0.10.34866 > 10.0.3.10.5201: Flags [.], seq 157870:159318, ack 1, win 83, options [nop,nop,TS val 1571301725 ecr 2654390609], length 1448
15:26:06.432933 IP 10.0.3.10.5201 > 10.0.0.10.34866: Flags [.], ack 115878, win 321, options [nop,nop,TS val 2654390618 ecr 1571301639], length 0
15:26:06.432934 IP 10.0.3.10.5201 > 10.0.0.10.34866: Flags [.], ack 117326, win 327, options [nop,nop,TS val 2654390618 ecr 1571301639], length 0
15:26:06.432934 IP 10.0.3.10.5201 > 10.0.0.10.34866: Flags [.], ack 118774, win 333, options [nop,nop,TS val 2654390618 ecr 1571301639], length 0
15:26:06.432948 IP 10.0.0.10.34866 > 10.0.3.10.5201: Flags [.], seq 159318:160766, ack 1, win 83, options [nop,nop,TS val 1571301729 ecr 2654390610], length 1448
15:26:06.435433 IP 10.0.3.10.5201 > 10.0.0.10.34866: Flags [.], ack 120222, win 338, options [nop,nop,TS val 2654390621 ecr 1571301639], length 0
15:26:06.435449 IP 10.0.0.10.34866 > 10.0.3.10.5201: Flags [.], seq 160766:162214, ack 1, win 83, options [nop,nop,TS val 1571301732 ecr 2654390613], length 1448
15:26:06.435452 IP 10.0.0.10.34866 > 10.0.3.10.5201: Flags [.], seq 162214:163662, ack 1, win 83, options [nop,nop,TS val 1571301732 ecr 2654390613], length 1448
15:26:06.438098 IP 10.0.3.10.5201 > 10.0.0.10.34866: Flags [.], ack 121670, win 344, options [nop,nop,TS val 2654390624 ecr 1571301644], length 0
15:26:06.438099 IP 10.0.3.10.5201 > 10.0.0.10.34866: Flags [.], ack 123118, win 350, options [nop,nop,TS val 2654390624 ecr 1571301644], length 0
15:26:06.438110 IP 10.0.0.10.34866 > 10.0.3.10.5201: Flags [.], seq 163662:165110, ack 1, win 83, options [nop,nop,TS val 1571301735 ecr 2654390618], length 1448
15:26:06.438113 IP 10.0.0.10.34866 > 10.0.3.10.5201: Flags [P.], seq 165110:166558, ack 1, win 83, options [nop,nop,TS val 1571301735 ecr 2654390618], length 1448
15:26:06.438114 IP 10.0.0.10.34866 > 10.0.3.10.5201: Flags [.], seq 166558:168006, ack 1, win 83, options [nop,nop,TS val 1571301735 ecr 2654390618], length 1448
15:26:06.438115 IP 10.0.0.10.34866 > 10.0.3.10.5201: Flags [.], seq 168006:169454, ack 1, win 83, options [nop,nop,TS val 1571301735 ecr 2654390618], length 1448
15:26:06.441203 IP 10.0.3.10.5201 > 10.0.0.10.34866: Flags [.], ack 124566, win 355, options [nop,nop,TS val 2654390626 ecr 1571301647], length 0
15:26:06.441204 IP 10.0.3.10.5201 > 10.0.0.10.34866: Flags [.], ack 126014, win 361, options [nop,nop,TS val 2654390626 ecr 1571301647], length 0
15:26:06.441206 IP 10.0.0.10.34866 > 10.0.3.10.5201: Flags [.], seq 169454:170902, ack 1, win 83, options [nop,nop,TS val 1571301737 ecr 2654390621], length 1448
15:26:06.443151 IP 10.0.3.10.5201 > 10.0.0.10.34866: Flags [.], ack 127462, win 367, options [nop,nop,TS val 2654390629 ecr 1571301651], length 0
15:26:06.443181 IP 10.0.0.10.34866 > 10.0.3.10.5201: Flags [.], seq 170902:172350, ack 1, win 83, options [nop,nop,TS val 1571301740 ecr 2654390624], length 1448
15:26:06.443184 IP 10.0.0.10.34866 > 10.0.3.10.5201: Flags [.], seq 172350:173798, ack 1, win 83, options [nop,nop,TS val 1571301740 ecr 2654390624], length 1448
15:26:06.448127 IP 10.0.3.10.5201 > 10.0.0.10.34866: Flags [.], ack 128910, win 372, options [nop,nop,TS val 2654390631 ecr 1571301651], length 0
15:26:06.448140 IP 10.0.3.10.5201 > 10.0.0.10.34866: Flags [.], ack 130358, win 378, options [nop,nop,TS val 2654390631 ecr 1571301653], length 0
15:26:06.448141 IP 10.0.3.10.5201 > 10.0.0.10.34866: Flags [.], ack 131806, win 384, options [nop,nop,TS val 2654390633 ecr 1571301653], length 0
15:26:06.448159 IP 10.0.0.10.34866 > 10.0.3.10.5201: Flags [.], seq 173798:175246, ack 1, win 83, options [nop,nop,TS val 1571301743 ecr 2654390626], length 1448
15:26:06.448162 IP 10.0.0.10.34866 > 10.0.3.10.5201: Flags [.], seq 175246:176694, ack 1, win 83, options [nop,nop,TS val 1571301743 ecr 2654390626], length 1448
15:26:06.448261 IP 10.0.0.10.34866 > 10.0.3.10.5201: Flags [.], seq 176694:178142, ack 1, win 83, options [nop,nop,TS val 1571301745 ecr 2654390629], length 1448
15:26:06.448262 IP 10.0.0.10.34866 > 10.0.3.10.5201: Flags [.], seq 178142:179590, ack 1, win 83, options [nop,nop,TS val 1571301745 ecr 2654390629], length 1448
15:26:06.453243 IP 10.0.0.10.34866 > 10.0.3.10.5201: Flags [.], seq 179590:181038, ack 1, win 83, options [nop,nop,TS val 1571301750 ecr 2654390631], length 1448
15:26:06.453291 IP 10.0.0.10.34866 > 10.0.3.10.5201: Flags [.], seq 181038:182486, ack 1, win 83, options [nop,nop,TS val 1571301750 ecr 2654390633], length 1448
15:26:06.453294 IP 10.0.0.10.34866 > 10.0.3.10.5201: Flags [.], seq 182486:183934, ack 1, win 83, options [nop,nop,TS val 1571301750 ecr 2654390633], length 1448
15:26:06.457778 IP 10.0.3.10.5201 > 10.0.0.10.34866: Flags [.], ack 133254, win 389, options [nop,nop,TS val 2654390643 ecr 1571301665], length 0
15:26:06.458736 IP 10.0.3.10.5201 > 10.0.0.10.34866: Flags [.], ack 134702, win 395, options [nop,nop,TS val 2654390644 ecr 1571301665], length 0
15:26:06.471150 IP 10.0.3.10.5201 > 10.0.0.10.34866: Flags [.], ack 136150, win 400, options [nop,nop,TS val 2654390648 ecr 1571301670], length 0
15:26:06.471178 IP 10.0.3.10.5201 > 10.0.0.10.34866: Flags [.], ack 137598, win 406, options [nop,nop,TS val 2654390649 ecr 1571301670], length 0
15:26:06.471189 IP 10.0.0.10.34866 > 10.0.3.10.5201: Flags [.], seq 183934:185382, ack 1, win 83, options [nop,nop,TS val 1571301760 ecr 2654390643], length 1448
15:26:06.476317 IP 10.0.0.10.34866 > 10.0.3.10.5201: Flags [.], seq 185382:186830, ack 1, win 83, options [nop,nop,TS val 1571301773 ecr 2654390648], length 1448
15:26:06.476375 IP 10.0.0.10.34866 > 10.0.3.10.5201: Flags [.], seq 186830:188278, ack 1, win 83, options [nop,nop,TS val 1571301773 ecr 2654390648], length 1448
15:26:06.494252 IP 10.0.3.10.5201 > 10.0.0.10.34866: Flags [.], ack 139046, win 412, options [nop,nop,TS val 2654390679 ecr 1571301712], length 0
15:26:06.495274 IP 10.0.3.10.5201 > 10.0.0.10.34866: Flags [.], ack 140494, win 417, options [nop,nop,TS val 2654390681 ecr 1571301712], length 0
15:26:06.498180 IP 10.0.3.10.5201 > 10.0.0.10.34866: Flags [.], ack 141942, win 423, options [nop,nop,TS val 2654390682 ecr 1571301713], length 0
15:26:06.498182 IP 10.0.3.10.5201 > 10.0.0.10.34866: Flags [.], ack 143390, win 429, options [nop,nop,TS val 2654390684 ecr 1571301713], length 0
15:26:06.498594 IP 10.0.3.10.5201 > 10.0.0.10.34866: Flags [.], ack 144838, win 434, options [nop,nop,TS val 2654390684 ecr 1571301713], length 0
15:26:06.500099 IP 10.0.0.10.34866 > 10.0.3.10.5201: Flags [.], seq 188278:189726, ack 1, win 83, options [nop,nop,TS val 1571301796 ecr 2654390679], length 1448
15:26:06.500103 IP 10.0.0.10.34866 > 10.0.3.10.5201: Flags [.], seq 189726:191174, ack 1, win 83, options [nop,nop,TS val 1571301796 ecr 2654390679], length 1448
15:26:06.501034 IP 10.0.3.10.5201 > 10.0.0.10.34866: Flags [.], ack 146286, win 440, options [nop,nop,TS val 2654390686 ecr 1571301717], length 0
15:26:06.501039 IP 10.0.0.10.34866 > 10.0.3.10.5201: Flags [.], seq 191174:192622, ack 1, win 83, options [nop,nop,TS val 1571301797 ecr 2654390681], length 1448
15:26:06.501952 IP 10.0.3.10.5201 > 10.0.0.10.34866: Flags [.], ack 147734, win 446, options [nop,nop,TS val 2654390687 ecr 1571301717], length 0
15:26:06.503224 IP 10.0.3.10.5201 > 10.0.0.10.34866: Flags [.], ack 149182, win 451, options [nop,nop,TS val 2654390689 ecr 1571301717], length 0
15:26:06.503231 IP 10.0.0.10.34866 > 10.0.3.10.5201: Flags [.], seq 192622:194070, ack 1, win 83, options [nop,nop,TS val 1571301800 ecr 2654390682], length 1448
15:26:06.503794 IP 10.0.3.10.5201 > 10.0.0.10.34866: Flags [.], ack 150630, win 457, options [nop,nop,TS val 2654390689 ecr 1571301719], length 0
15:26:06.503853 IP 10.0.0.10.34866 > 10.0.3.10.5201: Flags [.], seq 194070:195518, ack 1, win 83, options [nop,nop,TS val 1571301800 ecr 2654390684], length 1448
15:26:06.503856 IP 10.0.0.10.34866 > 10.0.3.10.5201: Flags [.], seq 195518:196966, ack 1, win 83, options [nop,nop,TS val 1571301800 ecr 2654390684], length 1448
15:26:06.505883 IP 10.0.3.10.5201 > 10.0.0.10.34866: Flags [.], ack 152078, win 463, options [nop,nop,TS val 2654390691 ecr 1571301723], length 0
15:26:06.506320 IP 10.0.3.10.5201 > 10.0.0.10.34866: Flags [.], ack 153526, win 468, options [nop,nop,TS val 2654390692 ecr 1571301723], length 0
15:26:06.506350 IP 10.0.0.10.34866 > 10.0.3.10.5201: Flags [.], seq 196966:198414, ack 1, win 83, options [nop,nop,TS val 1571301803 ecr 2654390686], length 1448
15:26:06.507000 IP 10.0.3.10.5201 > 10.0.0.10.34866: Flags [.], ack 154974, win 474, options [nop,nop,TS val 2654390693 ecr 1571301725], length 0
15:26:06.509845 IP 10.0.3.10.5201 > 10.0.0.10.34866: Flags [.], ack 156422, win 480, options [nop,nop,TS val 2654390694 ecr 1571301725], length 0
15:26:06.509890 IP 10.0.0.10.34866 > 10.0.3.10.5201: Flags [.], seq 198414:199862, ack 1, win 83, options [nop,nop,TS val 1571301805 ecr 2654390689], length 1448
15:26:06.509893 IP 10.0.0.10.34866 > 10.0.3.10.5201: Flags [.], seq 199862:201310, ack 1, win 83, options [nop,nop,TS val 1571301805 ecr 2654390689], length 1448
15:26:06.509897 IP 10.0.0.10.34866 > 10.0.3.10.5201: Flags [.], seq 201310:202758, ack 1, win 83, options [nop,nop,TS val 1571301806 ecr 2654390689], length 1448
15:26:06.509898 IP 10.0.0.10.34866 > 10.0.3.10.5201: Flags [.], seq 202758:204206, ack 1, win 83, options [nop,nop,TS val 1571301806 ecr 2654390689], length 1448
