12:35:22.046004 IP 10.0.0.10.43940 > 10.0.8.10.5201: Flags [S], seq 750561972, win 42340, options [mss 1460,sackOK,TS val 2900946074 ecr 0,nop,wscale 9], length 0
12:35:22.046207 IP 10.0.8.10.5201 > 10.0.0.10.43940: Flags [S.], seq 3033068769, ack 750561973, win 43440, options [mss 1460,sackOK,TS val 1570340888 ecr 2900946074,nop,wscale 9], length 0
12:35:22.062865 IP 10.0.0.10.43940 > 10.0.8.10.5201: Flags [.], ack 1, win 83, options [nop,nop,TS val 2900946106 ecr 1570340888], length 0
12:35:22.062880 IP 10.0.0.10.43940 > 10.0.8.10.5201: Flags [P.], seq 1:38, ack 1, win 83, options [nop,nop,TS val 2900946106 ecr 1570340888], length 37
12:35:22.063035 IP 10.0.8.10.5201 > 10.0.0.10.43940: Flags [.], ack 38, win 85, options [nop,nop,TS val 1570340905 ecr 2900946106], length 0
12:35:22.063334 IP 10.0.8.10.5201 > 10.0.0.10.43940: Flags [P.], seq 1:2, ack 38, win 85, options [nop,nop,TS val 1570340905 ecr 2900946106], length 1
12:35:22.079028 IP 10.0.0.10.43940 > 10.0.8.10.5201: Flags [.], ack 2, win 83, options [nop,nop,TS val 2900946123 ecr 1570340905], length 0
12:35:22.079035 IP 10.0.0.10.43940 > 10.0.8.10.5201: Flags [P.], seq 38:42, ack 2, win 83, options [nop,nop,TS val 2900946123 ecr 1570340905], length 4
12:35:22.079098 IP 10.0.8.10.5201 > 10.0.0.10.43940: Flags [.], ack 42, win 85, options [nop,nop,TS val 1570340921 ecr 2900946123], length 0
12:35:22.094498 IP 10.0.0.10.43940 > 10.0.8.10.5201: Flags [P.], seq 42:144, ack 2, win 83, options [nop,nop,TS val 2900946139 ecr 1570340921], length 102
12:35:22.094553 IP 10.0.8.10.5201 > 10.0.0.10.43940: Flags [.], ack 144, win 85, options [nop,nop,TS val 1570340936 ecr 2900946139], length 0
12:35:22.094672 IP 10.0.8.10.5201 > 10.0.0.10.43940: Flags [P.], seq 2:3, ack 144, win 85, options [nop,nop,TS val 1570340936 ecr 2900946139], length 1
12:35:22.110062 IP 10.0.0.10.43940 > 10.0.8.10.5201: Flags [.], ack 3, win 83, options [nop,nop,TS val 2900946154 ecr 1570340936], length 0
12:35:22.110065 IP 10.0.0.10.43958 > 10.0.8.10.5201: Flags [S], seq 731016370, win 42340, options [mss 1460,sackOK,TS val 2900946154 ecr 0,nop,wscale 9], length 0
12:35:22.110101 IP 10.0.8.10.5201 > 10.0.0.10.43958: Flags [S.], seq 3934514341, ack 731016371, win 43440, options [mss 1460,sackOK,TS val 1570340952 ecr 2900946154,nop,wscale 9], length 0
12:35:22.125206 IP 10.0.0.10.43958 > 10.0.8.10.5201: Flags [.], ack 1, win 83, options [nop,nop,TS val 2900946170 ecr 1570340952], length 0
12:35:22.125209 IP 10.0.0.10.43958 > 10.0.8.10.5201: Flags [P.], seq 1:38, ack 1, win 83, options [nop,nop,TS val 2900946170 ecr 1570340952], length 37
12:35:22.125256 IP 10.0.8.10.5201 > 10.0.0.10.43958: Flags [.], ack 38, win 85, options [nop,nop,TS val 1570340967 ecr 2900946170], length 0
12:35:22.128030 IP 10.0.8.10.5201 > 10.0.0.10.43940: Flags [P.], seq 3:4, ack 144, win 85, options [nop,nop,TS val 1570340970 ecr 2900946154], length 1
12:35:22.143203 IP 10.0.0.10.43940 > 10.0.8.10.5201: Flags [.], ack 4, win 83, options [nop,nop,TS val 2900946188 ecr 1570340970], length 0
12:35:22.143252 IP 10.0.8.10.5201 > 10.0.0.10.43940: Flags [P.], seq 4:5, ack 144, win 85, options [nop,nop,TS val 1570340985 ecr 2900946188], length 1
12:35:22.158324 IP 10.0.0.10.43940 > 10.0.8.10.5201: Flags [.], ack 5, win 83, options [nop,nop,TS val 2900946203 ecr 1570340985], length 0
12:35:22.170024 IP 10.0.0.10.43958 > 10.0.8.10.5201: Flags [.], seq 38:2934, ack 1, win 83, options [nop,nop,TS val 2900946214 ecr 1570340967], length 2896
12:35:22.170026 IP 10.0.0.10.43958 > 10.0.8.10.5201: Flags [.], seq 2934:5830, ack 1, win 83, options [nop,nop,TS val 2900946214 ecr 1570340967], length 2896
12:35:22.170028 IP 10.0.0.10.43958 > 10.0.8.10.5201: Flags [.], seq 5830:8726, ack 1, win 83, options [nop,nop,TS val 2900946214 ecr 1570340967], length 2896
12:35:22.170029 IP 10.0.0.10.43958 > 10.0.8.10.5201: Flags [.], seq 8726:11622, ack 1, win 83, options [nop,nop,TS val 2900946214 ecr 1570340967], length 2896
12:35:22.170030 IP 10.0.0.10.43958 > 10.0.8.10.5201: Flags [.], seq 11622:14518, ack 1, win 83, options [nop,nop,TS val 2900946214 ecr 1570340967], length 2896
12:35:22.170051 IP 10.0.8.10.5201 > 10.0.0.10.43958: Flags [.], ack 2934, win 82, options [nop,nop,TS val 1570341012 ecr 2900946214], length 0
12:35:22.170056 IP 10.0.8.10.5201 > 10.0.0.10.43958: Flags [.], ack 5830, win 79, options [nop,nop,TS val 1570341012 ecr 2900946214], length 0
12:35:22.170058 IP 10.0.8.10.5201 > 10.0.0.10.43958: Flags [.], ack 8726, win 76, options [nop,nop,TS val 1570341012 ecr 2900946214], length 0
12:35:22.170060 IP 10.0.8.10.5201 > 10.0.0.10.43958: Flags [.], ack 11622, win 73, options [nop,nop,TS val 1570341012 ecr 2900946214], length 0
12:35:22.170062 IP 10.0.8.10.5201 > 10.0.0.10.43958: Flags [.], ack 14518, win 70, options [nop,nop,TS val 1570341012 ecr 2900946214], length 0
12:35:22.185259 IP 10.0.0.10.43958 > 10.0.8.10.5201: Flags [.], seq 14518:17414, ack 1, win 83, options [nop,nop,TS val 2900946230 ecr 1570341012], length 2896
12:35:22.185261 IP 10.0.0.10.43958 > 10.0.8.10.5201: Flags [.], seq 17414:20310, ack 1, win 83, options [nop,nop,TS val 2900946230 ecr 1570341012], length 2896
12:35:22.185262 IP 10.0.0.10.43958 > 10.0.8.10.5201: Flags [.], seq 20310:23206, ack 1, win 83, options [nop,nop,TS val 2900946230 ecr 1570341012], length 2896
12:35:22.185264 IP 10.0.0.10.43958 > 10.0.8.10.5201: Flags [.], seq 23206:26102, ack 1, win 83, options [nop,nop,TS val 2900946230 ecr 1570341012], length 2896
12:35:22.185265 IP 10.0.0.10.43958 > 10.0.8.10.5201: Flags [.], seq 26102:28998, ack 1, win 83, options [nop,nop,TS val 2900946230 ecr 1570341012], length 2896
12:35:22.185289 IP 10.0.8.10.5201 > 10.0.0.10.43958: Flags [.], ack 17414, win 82, options [nop,nop,TS val 1570341027 ecr 2900946230], length 0
12:35:22.185311 IP 10.0.8.10.5201 > 10.0.0.10.43958: Flags [.], ack 20310, win 79, options [nop,nop,TS val 1570341027 ecr 2900946230], length 0
12:35:22.185314 IP 10.0.8.10.5201 > 10.0.0.10.43958: Flags [.], ack 23206, win 76, options [nop,nop,TS val 1570341027 ecr 2900946230], length 0
12:35:22.185315 IP 10.0.8.10.5201 > 10.0.0.10.43958: Flags [.], ack 26102, win 73, options [nop,nop,TS val 1570341027 ecr 2900946230], length 0
12:35:22.185317 IP 10.0.8.10.5201 > 10.0.0.10.43958: Flags [.], ack 28998, win 70, options [nop,nop,TS val 1570341027 ecr 2900946230], length 0
12:35:22.186490 IP 10.0.0.10.43958 > 10.0.8.10.5201: Flags [.], seq 28998:31894, ack 1, win 83, options [nop,nop,TS val 2900946230 ecr 1570341012], length 2896
12:35:22.186491 IP 10.0.0.10.43958 > 10.0.8.10.5201: Flags [.], seq 31894:34790, ack 1, win 83, options [nop,nop,TS val 2900946230 ecr 1570341012], length 2896
12:35:22.186549 IP 10.0.8.10.5201 > 10.0.0.10.43958: Flags [.], ack 31894, win 82, options [nop,nop,TS val 1570341028 ecr 2900946230], length 0
12:35:22.186552 IP 10.0.8.10.5201 > 10.0.0.10.43958: Flags [.], ack 34790, win 79, options [nop,nop,TS val 1570341028 ecr 2900946230], length 0
12:35:22.187256 IP 10.0.0.10.43958 > 10.0.8.10.5201: Flags [P.], seq 34790:36238, ack 1, win 83, options [nop,nop,TS val 2900946230 ecr 1570341012], length 1448
12:35:22.187257 IP 10.0.0.10.43958 > 10.0.8.10.5201: Flags [.], seq 36238:39134, ack 1, win 83, options [nop,nop,TS val 2900946230 ecr 1570341012], length 2896
12:35:22.187258 IP 10.0.0.10.43958 > 10.0.8.10.5201: Flags [.], seq 39134:42030, ack 1, win 83, options [nop,nop,TS val 2900946230 ecr 1570341012], length 2896
12:35:22.187260 IP 10.0.0.10.43958 > 10.0.8.10.5201: Flags [.], seq 42030:43478, ack 1, win 83, options [nop,nop,TS val 2900946231 ecr 1570341012], length 1448
12:35:22.187301 IP 10.0.8.10.5201 > 10.0.0.10.43958: Flags [.], ack 36238, win 83, options [nop,nop,TS val 1570341029 ecr 2900946230], length 0
12:35:22.187304 IP 10.0.8.10.5201 > 10.0.0.10.43958: Flags [.], ack 39134, win 80, options [nop,nop,TS val 1570341029 ecr 2900946230], length 0
12:35:22.187306 IP 10.0.8.10.5201 > 10.0.0.10.43958: Flags [.], ack 42030, win 78, options [nop,nop,TS val 1570341029 ecr 2900946230], length 0
12:35:22.200344 IP 10.0.0.10.43958 > 10.0.8.10.5201: Flags [.], seq 43478:46374, ack 1, win 83, options [nop,nop,TS val 2900946245 ecr 1570341027], length 2896
12:35:22.200366 IP 10.0.8.10.5201 > 10.0.0.10.43958: Flags [.], ack 46374, win 82, options [nop,nop,TS val 1570341042 ecr 2900946231], length 0
12:35:22.200382 IP 10.0.0.10.43958 > 10.0.8.10.5201: Flags [.], seq 46374:49270, ack 1, win 83, options [nop,nop,TS val 2900946245 ecr 1570341027], length 2896
12:35:22.200384 IP 10.0.0.10.43958 > 10.0.8.10.5201: Flags [.], seq 49270:53614, ack 1, win 83, options [nop,nop,TS val 2900946245 ecr 1570341027], length 4344
12:35:22.200385 IP 10.0.0.10.43958 > 10.0.8.10.5201: Flags [P.], seq 53614:57958, ack 1, win 83, options [nop,nop,TS val 2900946245 ecr 1570341027], length 4344
12:35:22.200428 IP 10.0.8.10.5201 > 10.0.0.10.43958: Flags [.], ack 57958, win 83, options [nop,nop,TS val 1570341042 ecr 2900946245], length 0
12:35:22.201312 IP 10.0.0.10.43958 > 10.0.8.10.5201: Flags [.], seq 57958:62302, ack 1, win 83, options [nop,nop,TS val 2900946245 ecr 1570341027], length 4344
12:35:22.201388 IP 10.0.8.10.5201 > 10.0.0.10.43958: Flags [.], ack 62302, win 83, options [nop,nop,TS val 1570341043 ecr 2900946245], length 0
12:35:22.202329 IP 10.0.0.10.43958 > 10.0.8.10.5201: Flags [.], seq 62302:68094, ack 1, win 83, options [nop,nop,TS val 2900946246 ecr 1570341028], length 5792
12:35:22.202459 IP 10.0.8.10.5201 > 10.0.0.10.43958: Flags [.], ack 68094, win 83, options [nop,nop,TS val 1570341044 ecr 2900946246], length 0
12:35:22.203036 IP 10.0.0.10.43958 > 10.0.8.10.5201: Flags [.], seq 68094:73886, ack 1, win 83, options [nop,nop,TS val 2900946246 ecr 1570341028], length 5792
12:35:22.203089 IP 10.0.8.10.5201 > 10.0.0.10.43958: Flags [.], ack 73886, win 83, options [nop,nop,TS val 1570341045 ecr 2900946246], length 0
12:35:22.204140 IP 10.0.0.10.43958 > 10.0.8.10.5201: Flags [P.], seq 73886:79678, ack 1, win 83, options [nop,nop,TS val 2900946247 ecr 1570341029], length 5792
12:35:22.204256 IP 10.0.8.10.5201 > 10.0.0.10.43958: Flags [.], ack 79678, win 83, options [nop,nop,TS val 1570341046 ecr 2900946247], length 0
12:35:22.216546 IP 10.0.0.10.43958 > 10.0.8.10.5201: Flags [.], seq 79678:85470, ack 1, win 83, options [nop,nop,TS val 2900946260 ecr 1570341042], length 5792
12:35:22.216637 IP 10.0.8.10.5201 > 10.0.0.10.43958: Flags [.], ack 85470, win 106, options [nop,nop,TS val 1570341058 ecr 2900946260], length 0
12:35:22.216880 IP 10.0.0.10.43958 > 10.0.8.10.5201: Flags [.], seq 85470:92710, ack 1, win 83, options [nop,nop,TS val 2900946260 ecr 1570341042], length 7240
12:35:22.216895 IP 10.0.8.10.5201 > 10.0.0.10.43958: Flags [.], ack 92710, win 134, options [nop,nop,TS val 1570341058 ecr 2900946260], length 0
12:35:22.217145 IP 10.0.0.10.43958 > 10.0.8.10.5201: Flags [.], seq 92710:99950, ack 1, win 83, options [nop,nop,TS val 2900946260 ecr 1570341042], length 7240
12:35:22.217173 IP 10.0.8.10.5201 > 10.0.0.10.43958: Flags [.], ack 99950, win 162, options [nop,nop,TS val 1570341059 ecr 2900946260], length 0
12:35:22.218523 IP 10.0.0.10.43958 > 10.0.8.10.5201: Flags [.], seq 99950:101398, ack 1, win 83, options [nop,nop,TS val 2900946261 ecr 1570341043], length 1448
12:35:22.218553 IP 10.0.8.10.5201 > 10.0.0.10.43958: Flags [.], ack 101398, win 168, options [nop,nop,TS val 1570341060 ecr 2900946261], length 0
12:35:22.220873 IP 10.0.0.10.43958 > 10.0.8.10.5201: Flags [.], seq 101398:110086, ack 1, win 83, options [nop,nop,TS val 2900946262 ecr 1570341044], length 8688
12:35:22.220882 IP 10.0.8.10.5201 > 10.0.0.10.43958: Flags [.], ack 110086, win 202, options [nop,nop,TS val 1570341062 ecr 2900946262], length 0
12:35:22.223739 IP 10.0.0.10.43958 > 10.0.8.10.5201: Flags [.], seq 110086:120222, ack 1, win 83, options [nop,nop,TS val 2900946264 ecr 1570341046], length 10136
12:35:22.223741 IP 10.0.0.10.43958 > 10.0.8.10.5201: Flags [.], seq 120222:122174, ack 1, win 83, options [nop,nop,TS val 2900946264 ecr 1570341046], length 1952
12:35:22.223763 IP 10.0.8.10.5201 > 10.0.0.10.43958: Flags [.], ack 120222, win 241, options [nop,nop,TS val 1570341065 ecr 2900946264], length 0
12:35:22.223781 IP 10.0.8.10.5201 > 10.0.0.10.43958: Flags [.], ack 122174, win 249, options [nop,nop,TS val 1570341065 ecr 2900946264], length 0
12:35:22.240868 IP 10.0.0.10.43958 > 10.0.8.10.5201: Flags [P.], seq 122174:123118, ack 1, win 83, options [nop,nop,TS val 2900946276 ecr 1570341058], length 944
12:35:22.240960 IP 10.0.0.10.43958 > 10.0.8.10.5201: Flags [.], seq 123118:133254, ack 1, win 83, options [nop,nop,TS val 2900946276 ecr 1570341058], length 10136
12:35:22.240978 IP 10.0.8.10.5201 > 10.0.0.10.43958: Flags [.], ack 123118, win 255, options [nop,nop,TS val 1570341082 ecr 2900946276], length 0
12:35:22.241008 IP 10.0.8.10.5201 > 10.0.0.10.43958: Flags [.], ack 133254, win 294, options [nop,nop,TS val 1570341082 ecr 2900946276], length 0
12:35:22.242265 IP 10.0.0.10.43958 > 10.0.8.10.5201: Flags [.], seq 133254:143390, ack 1, win 83, options [nop,nop,TS val 2900946276 ecr 1570341058], length 10136
12:35:22.242266 IP 10.0.0.10.43958 > 10.0.8.10.5201: Flags [P.], seq 143390:144838, ack 1, win 83, options [nop,nop,TS val 2900946277 ecr 1570341059], length 1448
12:35:22.242283 IP 10.0.8.10.5201 > 10.0.0.10.43958: Flags [.], ack 143390, win 334, options [nop,nop,TS val 1570341084 ecr 2900946276], length 0
12:35:22.242285 IP 10.0.8.10.5201 > 10.0.0.10.43958: Flags [.], ack 144838, win 339, options [nop,nop,TS val 1570341084 ecr 2900946277], length 0
12:35:22.245419 IP 10.0.0.10.43958 > 10.0.8.10.5201: Flags [.], seq 144838:156422, ack 1, win 83, options [nop,nop,TS val 2900946277 ecr 1570341059], length 11584
12:35:22.245432 IP 10.0.8.10.5201 > 10.0.0.10.43958: Flags [.], ack 156422, win 385, options [nop,nop,TS val 1570341087 ecr 2900946277], length 0
12:35:22.247162 IP 10.0.0.10.43958 > 10.0.8.10.5201: Flags [.], seq 156422:166558, ack 1, win 83, options [nop,nop,TS val 2900946277 ecr 1570341059], length 10136
12:35:22.247222 IP 10.0.8.10.5201 > 10.0.0.10.43958: Flags [.], ack 166558, win 424, options [nop,nop,TS val 1570341089 ecr 2900946277], length 0
12:35:22.253121 IP 10.0.0.10.43958 > 10.0.8.10.5201: Flags [.], seq 166558:169454, ack 1, win 83, options [nop,nop,TS val 2900946283 ecr 1570341065], length 2896
12:35:22.253130 IP 10.0.8.10.5201 > 10.0.0.10.43958: Flags [.], ack 169454, win 436, options [nop,nop,TS val 1570341095 ecr 2900946283], length 0
12:35:22.253251 IP 10.0.0.10.43958 > 10.0.8.10.5201: Flags [.], seq 169454:172350, ack 1, win 83, options [nop,nop,TS val 2900946283 ecr 1570341065], length 2896
12:35:22.253260 IP 10.0.8.10.5201 > 10.0.0.10.43958: Flags [.], ack 172350, win 447, options [nop,nop,TS val 1570341095 ecr 2900946283], length 0
12:35:22.276360 IP 10.0.0.10.43958 > 10.0.8.10.5201: Flags [.], seq 172350:173798, ack 1, win 83, options [nop,nop,TS val 2900946301 ecr 1570341082], length 1448
12:35:22.276427 IP 10.0.8.10.5201 > 10.0.0.10.43958: Flags [.], ack 173798, win 453, options [nop,nop,TS val 1570341118 ecr 2900946301], length 0
12:35:22.276473 IP 10.0.0.10.43958 > 10.0.8.10.5201: Flags [.], seq 173798:176694, ack 1, win 83, options [nop,nop,TS val 2900946301 ecr 1570341082], length 2896
12:35:22.276508 IP 10.0.8.10.5201 > 10.0.0.10.43958: Flags [.], ack 176694, win 464, options [nop,nop,TS val 1570341118 ecr 2900946301], length 0
12:35:22.276536 IP 10.0.0.10.43958 > 10.0.8.10.5201: Flags [.], seq 176694:178142, ack 1, win 83, options [nop,nop,TS val 2900946301 ecr 1570341082], length 1448
12:35:22.276545 IP 10.0.8.10.5201 > 10.0.0.10.43958: Flags [.], ack 178142, win 470, options [nop,nop,TS val 1570341118 ecr 2900946301], length 0
12:35:22.276658 IP 10.0.0.10.43958 > 10.0.8.10.5201: Flags [.], seq 178142:181038, ack 1, win 83, options [nop,nop,TS val 2900946301 ecr 1570341082], length 2896
12:35:22.276667 IP 10.0.8.10.5201 > 10.0.0.10.43958: Flags [.], ack 181038, win 481, options [nop,nop,TS val 1570341118 ecr 2900946301], length 0
12:35:22.276781 IP 10.0.0.10.43958 > 10.0.8.10.5201: Flags [.], seq 181038:183934, ack 1, win 83, options [nop,nop,TS val 2900946301 ecr 1570341082], length 2896
12:35:22.276790 IP 10.0.8.10.5201 > 10.0.0.10.43958: Flags [.], ack 183934, win 492, options [nop,nop,TS val 1570341118 ecr 2900946301], length 0
12:35:22.277982 IP 10.0.0.10.43958 > 10.0.8.10.5201: Flags [.], seq 183934:186830, ack 1, win 83, options [nop,nop,TS val 2900946302 ecr 1570341084], length 2896
12:35:22.277984 IP 10.0.0.10.43958 > 10.0.8.10.5201: Flags [P.], seq 186830:188278, ack 1, win 83, options [nop,nop,TS val 2900946302 ecr 1570341084], length 1448
12:35:22.277998 IP 10.0.8.10.5201 > 10.0.0.10.43958: Flags [.], ack 186830, win 504, options [nop,nop,TS val 1570341120 ecr 2900946302], length 0
12:35:22.278002 IP 10.0.8.10.5201 > 10.0.0.10.43958: Flags [.], ack 188278, win 509, options [nop,nop,TS val 1570341120 ecr 2900946302], length 0
12:35:22.278048 IP 10.0.0.10.43958 > 10.0.8.10.5201: Flags [.], seq 188278:191174, ack 1, win 83, options [nop,nop,TS val 2900946302 ecr 1570341084], length 2896
12:35:22.278058 IP 10.0.8.10.5201 > 10.0.0.10.43958: Flags [.], ack 191174, win 520, options [nop,nop,TS val 1570341120 ecr 2900946302], length 0
12:35:22.280354 IP 10.0.0.10.43958 > 10.0.8.10.5201: Flags [.], seq 191174:194070, ack 1, win 83, options [nop,nop,TS val 2900946305 ecr 1570341087], length 2896
12:35:22.280355 IP 10.0.0.10.43958 > 10.0.8.10.5201: Flags [.], seq 194070:196966, ack 1, win 83, options [nop,nop,TS val 2900946305 ecr 1570341087], length 2896
12:35:22.280384 IP 10.0.8.10.5201 > 10.0.0.10.43958: Flags [.], ack 194070, win 532, options [nop,nop,TS val 1570341122 ecr 2900946305], length 0
12:35:22.280386 IP 10.0.8.10.5201 > 10.0.0.10.43958: Flags [.], ack 196966, win 543, options [nop,nop,TS val 1570341122 ecr 2900946305], length 0
12:35:22.280452 IP 10.0.0.10.43958 > 10.0.8.10.5201: Flags [.], seq 196966:199862, ack 1, win 83, options [nop,nop,TS val 2900946305 ecr 1570341087], length 2896
12:35:22.280462 IP 10.0.8.10.5201 > 10.0.0.10.43958: Flags [.], ack 199862, win 554, options [nop,nop,TS val 1570341122 ecr 2900946305], length 0
12:35:22.280538 IP 10.0.0.10.43958 > 10.0.8.10.5201: Flags [.], seq 199862:202758, ack 1, win 83, options [nop,nop,TS val 2900946305 ecr 1570341087], length 2896
12:35:22.280548 IP 10.0.8.10.5201 > 10.0.0.10.43958: Flags [.], ack 202758, win 566, options [nop,nop,TS val 1570341122 ecr 2900946305], length 0
12:35:22.282326 IP 10.0.0.10.43958 > 10.0.8.10.5201: Flags [.], seq 202758:205654, ack 1, win 83, options [nop,nop,TS val 2900946307 ecr 1570341089], length 2896
12:35:22.282328 IP 10.0.0.10.43958 > 10.0.8.10.5201: Flags [.], seq 205654:208550, ack 1, win 83, options [nop,nop,TS val 2900946307 ecr 1570341089], length 2896
12:35:22.282331 IP 10.0.0.10.43958 > 10.0.8.10.5201: Flags [.], seq 208550:209998, ack 1, win 83, options [nop,nop,TS val 2900946307 ecr 1570341089], length 1448
12:35:22.282365 IP 10.0.8.10.5201 > 10.0.0.10.43958: Flags [.], ack 205654, win 577, options [nop,nop,TS val 1570341124 ecr 2900946307], length 0
12:35:22.282369 IP 10.0.8.10.5201 > 10.0.0.10.43958: Flags [.], ack 208550, win 588, options [nop,nop,TS val 1570341124 ecr 2900946307], length 0
12:35:22.282371 IP 10.0.8.10.5201 > 10.0.0.10.43958: Flags [.], ack 209998, win 594, options [nop,nop,TS val 1570341124 ecr 2900946307], length 0
12:35:22.282384 IP 10.0.0.10.43958 > 10.0.8.10.5201: Flags [.], seq 209998:212894, ack 1, win 83, options [nop,nop,TS val 2900946307 ecr 1570341089], length 2896
12:35:22.282409 IP 10.0.8.10.5201 > 10.0.0.10.43958: Flags [.], ack 212894, win 605, options [nop,nop,TS val 1570341124 ecr 2900946307], length 0
12:35:22.289310 IP 10.0.0.10.43958 > 10.0.8.10.5201: Flags [.], seq 212894:215790, ack 1, win 83, options [nop,nop,TS val 2900946313 ecr 1570341095], length 2896
12:35:22.289313 IP 10.0.0.10.43958 > 10.0.8.10.5201: Flags [.], seq 215790:218686, ack 1, win 83, options [nop,nop,TS val 2900946313 ecr 1570341095], length 2896
12:35:22.289314 IP 10.0.0.10.43958 > 10.0.8.10.5201: Flags [.], seq 218686:221582, ack 1, win 83, options [nop,nop,TS val 2900946313 ecr 1570341095], length 2896
12:35:22.289369 IP 10.0.8.10.5201 > 10.0.0.10.43958: Flags [.], ack 215790, win 617, options [nop,nop,TS val 1570341131 ecr 2900946313], length 0
12:35:22.289372 IP 10.0.8.10.5201 > 10.0.0.10.43958: Flags [.], ack 218686, win 628, options [nop,nop,TS val 1570341131 ecr 2900946313], length 0
12:35:22.289374 IP 10.0.8.10.5201 > 10.0.0.10.43958: Flags [.], ack 221582, win 639, options [nop,nop,TS val 1570341131 ecr 2900946313], length 0
12:35:22.306834 IP 10.0.0.10.43958 > 10.0.8.10.5201: Flags [.], seq 221582:224478, ack 1, win 83, options [nop,nop,TS val 2900946336 ecr 1570341118], length 2896
12:35:22.306906 IP 10.0.8.10.5201 > 10.0.0.10.43958: Flags [.], ack 224478, win 651, options [nop,nop,TS val 1570341148 ecr 2900946336], length 0
12:35:22.307324 IP 10.0.0.10.43958 > 10.0.8.10.5201: Flags [.], seq 224478:227374, ack 1, win 83, options [nop,nop,TS val 2900946336 ecr 1570341118], length 2896
12:35:22.307333 IP 10.0.8.10.5201 > 10.0.0.10.43958: Flags [.], ack 227374, win 662, options [nop,nop,TS val 1570341149 ecr 2900946336], length 0
12:35:22.307445 IP 10.0.0.10.43958 > 10.0.8.10.5201: Flags [.], seq 227374:230270, ack 1, win 83, options [nop,nop,TS val 2900946336 ecr 1570341118], length 2896
12:35:22.307455 IP 10.0.8.10.5201 > 10.0.0.10.43958: Flags [.], ack 230270, win 673, options [nop,nop,TS val 1570341149 ecr 2900946336], length 0
12:35:22.307506 IP 10.0.0.10.43958 > 10.0.8.10.5201: Flags [P.], seq 230270:231718, ack 1, win 83, options [nop,nop,TS val 2900946336 ecr 1570341118], length 1448
12:35:22.307515 IP 10.0.8.10.5201 > 10.0.0.10.43958: Flags [.], ack 231718, win 679, options [nop,nop,TS val 1570341149 ecr 2900946336], length 0
12:35:22.307734 IP 10.0.0.10.43958 > 10.0.8.10.5201: Flags [.], seq 231718:234614, ack 1, win 83, options [nop,nop,TS val 2900946336 ecr 1570341118], length 2896
12:35:22.307774 IP 10.0.8.10.5201 > 10.0.0.10.43958: Flags [.], ack 234614, win 690, options [nop,nop,TS val 1570341149 ecr 2900946336], length 0
12:35:22.308274 IP 10.0.0.10.43958 > 10.0.8.10.5201: Flags [.], seq 234614:237510, ack 1, win 83, options [nop,nop,TS val 2900946338 ecr 1570341120], length 2896
12:35:22.308276 IP 10.0.0.10.43958 > 10.0.8.10.5201: Flags [.], seq 237510:240406, ack 1, win 83, options [nop,nop,TS val 2900946338 ecr 1570341120], length 2896
12:35:22.308296 IP 10.0.8.10.5201 > 10.0.0.10.43958: Flags [.], ack 237510, win 701, options [nop,nop,TS val 1570341150 ecr 2900946338], length 0
12:35:22.308299 IP 10.0.8.10.5201 > 10.0.0.10.43958: Flags [.], ack 240406, win 713, options [nop,nop,TS val 1570341150 ecr 2900946338], length 0
12:35:22.309740 IP 10.0.0.10.43958 > 10.0.8.10.5201: Flags [.], seq 240406:243302, ack 1, win 83, options [nop,nop,TS val 2900946340 ecr 1570341122], length 2896
12:35:22.309778 IP 10.0.8.10.5201 > 10.0.0.10.43958: Flags [.], ack 243302, win 724, options [nop,nop,TS val 1570341151 ecr 2900946340], length 0
12:35:22.309870 IP 10.0.0.10.43958 > 10.0.8.10.5201: Flags [.], seq 243302:246198, ack 1, win 83, options [nop,nop,TS val 2900946340 ecr 1570341122], length 2896
12:35:22.309880 IP 10.0.8.10.5201 > 10.0.0.10.43958: Flags [.], ack 246198, win 735, options [nop,nop,TS val 1570341151 ecr 2900946340], length 0
12:35:22.309983 IP 10.0.0.10.43958 > 10.0.8.10.5201: Flags [.], seq 246198:249094, ack 1, win 83, options [nop,nop,TS val 2900946340 ecr 1570341122], length 2896
12:35:22.309992 IP 10.0.8.10.5201 > 10.0.0.10.43958: Flags [.], ack 249094, win 747, options [nop,nop,TS val 1570341152 ecr 2900946340], length 0
12:35:22.310406 IP 10.0.0.10.43958 > 10.0.8.10.5201: Flags [.], seq 249094:251990, ack 1, win 83, options [nop,nop,TS val 2900946340 ecr 1570341122], length 2896
12:35:22.310408 IP 10.0.0.10.43958 > 10.0.8.10.5201: Flags [.], seq 251990:253438, ack 1, win 83, options [nop,nop,TS val 2900946340 ecr 1570341122], length 1448
12:35:22.310430 IP 10.0.8.10.5201 > 10.0.0.10.43958: Flags [.], ack 251990, win 758, options [nop,nop,TS val 1570341152 ecr 2900946340], length 0
12:35:22.310434 IP 10.0.8.10.5201 > 10.0.0.10.43958: Flags [.], ack 253438, win 764, options [nop,nop,TS val 1570341152 ecr 2900946340], length 0
12:35:22.311010 IP 10.0.0.10.43958 > 10.0.8.10.5201: Flags [.], seq 253438:256334, ack 1, win 83, options [nop,nop,TS val 2900946342 ecr 1570341124], length 2896
12:35:22.311025 IP 10.0.8.10.5201 > 10.0.0.10.43958: Flags [.], ack 256334, win 775, options [nop,nop,TS val 1570341153 ecr 2900946342], length 0
12:35:22.311146 IP 10.0.0.10.43958 > 10.0.8.10.5201: Flags [.], seq 256334:259230, ack 1, win 83, options [nop,nop,TS val 2900946342 ecr 1570341124], length 2896
12:35:22.311158 IP 10.0.8.10.5201 > 10.0.0.10.43958: Flags [.], ack 259230, win 786, options [nop,nop,TS val 1570341153 ecr 2900946342], length 0
12:35:22.311258 IP 10.0.0.10.43958 > 10.0.8.10.5201: Flags [.], seq 259230:262126, ack 1, win 83, options [nop,nop,TS val 2900946342 ecr 1570341124], length 2896
12:35:22.311270 IP 10.0.8.10.5201 > 10.0.0.10.43958: Flags [.], ack 262126, win 798, options [nop,nop,TS val 1570341153 ecr 2900946342], length 0
12:35:22.317493 IP 10.0.0.10.43958 > 10.0.8.10.5201: Flags [.], seq 262126:265022, ack 1, win 83, options [nop,nop,TS val 2900946349 ecr 1570341131], length 2896
12:35:22.317505 IP 10.0.8.10.5201 > 10.0.0.10.43958: Flags [.], ack 265022, win 809, options [nop,nop,TS val 1570341159 ecr 2900946349], length 0
12:35:22.318077 IP 10.0.0.10.43958 > 10.0.8.10.5201: Flags [.], seq 265022:267918, ack 1, win 83, options [nop,nop,TS val 2900946349 ecr 1570341131], length 2896
12:35:22.318083 IP 10.0.0.10.43958 > 10.0.8.10.5201: Flags [.], seq 267918:270814, ack 1, win 83, options [nop,nop,TS val 2900946349 ecr 1570341131], length 2896
12:35:22.318084 IP 10.0.0.10.43958 > 10.0.8.10.5201: Flags [.], seq 270814:273710, ack 1, win 83, options [nop,nop,TS val 2900946349 ecr 1570341131], length 2896
12:35:22.318107 IP 10.0.8.10.5201 > 10.0.0.10.43958: Flags [.], ack 267918, win 820, options [nop,nop,TS val 1570341160 ecr 2900946349], length 0
12:35:22.318118 IP 10.0.8.10.5201 > 10.0.0.10.43958: Flags [.], ack 270814, win 832, options [nop,nop,TS val 1570341160 ecr 2900946349], length 0
12:35:22.318120 IP 10.0.8.10.5201 > 10.0.0.10.43958: Flags [.], ack 273710, win 843, options [nop,nop,TS val 1570341160 ecr 2900946349], length 0
12:35:22.343295 IP 10.0.0.10.43958 > 10.0.8.10.5201: Flags [P.], seq 273710:275158, ack 1, win 83, options [nop,nop,TS val 2900946366 ecr 1570341148], length 1448
12:35:22.343310 IP 10.0.8.10.5201 > 10.0.0.10.43958: Flags [.], ack 275158, win 849, options [nop,nop,TS val 1570341185 ecr 2900946366], length 0
12:35:22.344970 IP 10.0.0.10.43958 > 10.0.8.10.5201: Flags [.], seq 275158:278054, ack 1, win 83, options [nop,nop,TS val 2900946367 ecr 1570341149], length 2896
12:35:22.344972 IP 10.0.0.10.43958 > 10.0.8.10.5201: Flags [.], seq 278054:280950, ack 1, win 83, options [nop,nop,TS val 2900946367 ecr 1570341149], length 2896
12:35:22.344973 IP 10.0.0.10.43958 > 10.0.8.10.5201: Flags [.], seq 280950:283846, ack 1, win 83, options [nop,nop,TS val 2900946367 ecr 1570341149], length 2896
12:35:22.345005 IP 10.0.8.10.5201 > 10.0.0.10.43958: Flags [.], ack 278054, win 860, options [nop,nop,TS val 1570341187 ecr 2900946367], length 0
12:35:22.345007 IP 10.0.8.10.5201 > 10.0.0.10.43958: Flags [.], ack 280950, win 871, options [nop,nop,TS val 1570341187 ecr 2900946367], length 0
12:35:22.345009 IP 10.0.8.10.5201 > 10.0.0.10.43958: Flags [.], ack 283846, win 882, options [nop,nop,TS val 1570341187 ecr 2900946367], length 0
12:35:22.346067 IP 10.0.0.10.43958 > 10.0.8.10.5201: Flags [.], seq 283846:286742, ack 1, win 83, options [nop,nop,TS val 2900946367 ecr 1570341149], length 2896
12:35:22.346155 IP 10.0.8.10.5201 > 10.0.0.10.43958: Flags [.], ack 286742, win 894, options [nop,nop,TS val 1570341188 ecr 2900946367], length 0
12:35:22.346184 IP 10.0.0.10.43958 > 10.0.8.10.5201: Flags [.], seq 286742:289638, ack 1, win 83, options [nop,nop,TS val 2900946368 ecr 1570341150], length 2896
12:35:22.346197 IP 10.0.8.10.5201 > 10.0.0.10.43958: Flags [.], ack 289638, win 905, options [nop,nop,TS val 1570341188 ecr 2900946368], length 0
12:35:22.346266 IP 10.0.0.10.43958 > 10.0.8.10.5201: Flags [.], seq 289638:292534, ack 1, win 83, options [nop,nop,TS val 2900946368 ecr 1570341150], length 2896
12:35:22.346333 IP 10.0.8.10.5201 > 10.0.0.10.43958: Flags [.], ack 292534, win 916, options [nop,nop,TS val 1570341188 ecr 2900946368], length 0
12:35:22.348544 IP 10.0.0.10.43958 > 10.0.8.10.5201: Flags [.], seq 292534:295430, ack 1, win 83, options [nop,nop,TS val 2900946369 ecr 1570341151], length 2896
12:35:22.348546 IP 10.0.0.10.43958 > 10.0.8.10.5201: Flags [.], seq 295430:296878, ack 1, win 83, options [nop,nop,TS val 2900946369 ecr 1570341151], length 1448
12:35:22.348548 IP 10.0.0.10.43958 > 10.0.8.10.5201: Flags [.], seq 296878:299774, ack 1, win 83, options [nop,nop,TS val 2900946370 ecr 1570341152], length 2896
12:35:22.348549 IP 10.0.0.10.43958 > 10.0.8.10.5201: Flags [.], seq 299774:302670, ack 1, win 83, options [nop,nop,TS val 2900946370 ecr 1570341152], length 2896
12:35:22.348551 IP 10.0.0.10.43958 > 10.0.8.10.5201: Flags [.], seq 302670:305566, ack 1, win 83, options [nop,nop,TS val 2900946370 ecr 1570341152], length 2896
12:35:22.348630 IP 10.0.8.10.5201 > 10.0.0.10.43958: Flags [.], ack 295430, win 928, options [nop,nop,TS val 1570341190 ecr 2900946369], length 0
12:35:22.348635 IP 10.0.8.10.5201 > 10.0.0.10.43958: Flags [.], ack 296878, win 933, options [nop,nop,TS val 1570341190 ecr 2900946369], length 0
12:35:22.348637 IP 10.0.8.10.5201 > 10.0.0.10.43958: Flags [.], ack 305566, win 967, options [nop,nop,TS val 1570341190 ecr 2900946370], length 0
12:35:22.348637 IP 10.0.8.10.5201 > 10.0.0.10.43958: Flags [.], ack 299774, win 945, options [nop,nop,TS val 1570341190 ecr 2900946370], length 0
12:35:22.348639 IP 10.0.8.10.5201 > 10.0.0.10.43958: Flags [.], ack 302670, win 956, options [nop,nop,TS val 1570341190 ecr 2900946370], length 0
12:35:22.349988 IP 10.0.0.10.43958 > 10.0.8.10.5201: Flags [.], seq 305566:308462, ack 1, win 83, options [nop,nop,TS val 2900946371 ecr 1570341153], length 2896
12:35:22.349989 IP 10.0.0.10.43958 > 10.0.8.10.5201: Flags [.], seq 308462:311358, ack 1, win 83, options [nop,nop,TS val 2900946371 ecr 1570341153], length 2896
12:35:22.350016 IP 10.0.8.10.5201 > 10.0.0.10.43958: Flags [.], ack 308462, win 979, options [nop,nop,TS val 1570341192 ecr 2900946371], length 0
12:35:22.350018 IP 10.0.8.10.5201 > 10.0.0.10.43958: Flags [.], ack 311358, win 990, options [nop,nop,TS val 1570341192 ecr 2900946371], length 0
12:35:22.350245 IP 10.0.0.10.43958 > 10.0.8.10.5201: Flags [.], seq 311358:314254, ack 1, win 83, options [nop,nop,TS val 2900946371 ecr 1570341153], length 2896
12:35:22.350259 IP 10.0.8.10.5201 > 10.0.0.10.43958: Flags [.], ack 314254, win 1001, options [nop,nop,TS val 1570341192 ecr 2900946371], length 0
12:35:22.361350 IP 10.0.0.10.43958 > 10.0.8.10.5201: Flags [.], seq 314254:317150, ack 1, win 83, options [nop,nop,TS val 2900946377 ecr 1570341159], length 2896
12:35:22.361364 IP 10.0.8.10.5201 > 10.0.0.10.43958: Flags [.], ack 317150, win 1013, options [nop,nop,TS val 1570341203 ecr 2900946377], length 0
12:35:22.361453 IP 10.0.0.10.43958 > 10.0.8.10.5201: Flags [P.], seq 317150:318598, ack 1, win 83, options [nop,nop,TS val 2900946378 ecr 1570341160], length 1448
12:35:22.361467 IP 10.0.8.10.5201 > 10.0.0.10.43958: Flags [.], ack 318598, win 1018, options [nop,nop,TS val 1570341203 ecr 2900946378], length 0
12:35:22.362910 IP 10.0.0.10.43958 > 10.0.8.10.5201: Flags [.], seq 318598:321494, ack 1, win 83, options [nop,nop,TS val 2900946378 ecr 1570341160], length 2896
12:35:22.362912 IP 10.0.0.10.43958 > 10.0.8.10.5201: Flags [.], seq 321494:324390, ack 1, win 83, options [nop,nop,TS val 2900946378 ecr 1570341160], length 2896
12:35:22.362913 IP 10.0.0.10.43958 > 10.0.8.10.5201: Flags [.], seq 324390:327286, ack 1, win 83, options [nop,nop,TS val 2900946378 ecr 1570341160], length 2896
12:35:22.362943 IP 10.0.8.10.5201 > 10.0.0.10.43958: Flags [.], ack 321494, win 1030, options [nop,nop,TS val 1570341204 ecr 2900946378], length 0
12:35:22.362946 IP 10.0.8.10.5201 > 10.0.0.10.43958: Flags [.], ack 324390, win 1041, options [nop,nop,TS val 1570341204 ecr 2900946378], length 0
12:35:22.362947 IP 10.0.8.10.5201 > 10.0.0.10.43958: Flags [.], ack 327286, win 1052, options [nop,nop,TS val 1570341204 ecr 2900946378], length 0
12:35:22.390437 IP 10.0.0.10.43958 > 10.0.8.10.5201: Flags [.], seq 327286:328734, ack 1, win 83, options [nop,nop,TS val 2900946403 ecr 1570341185], length 1448
12:35:22.390454 IP 10.0.8.10.5201 > 10.0.0.10.43958: Flags [.], ack 328734, win 1058, options [nop,nop,TS val 1570341232 ecr 2900946403], length 0
12:35:22.390865 IP 10.0.0.10.43958 > 10.0.8.10.5201: Flags [.], seq 328734:331630, ack 1, win 83, options [nop,nop,TS val 2900946405 ecr 1570341187], length 2896
12:35:22.390900 IP 10.0.8.10.5201 > 10.0.0.10.43958: Flags [.], ack 331630, win 1069, options [nop,nop,TS val 1570341232 ecr 2900946405], length 0
12:35:22.391013 IP 10.0.0.10.43958 > 10.0.8.10.5201: Flags [.], seq 331630:334526, ack 1, win 83, options [nop,nop,TS val 2900946405 ecr 1570341187], length 2896
12:35:22.391027 IP 10.0.8.10.5201 > 10.0.0.10.43958: Flags [.], ack 334526, win 1080, options [nop,nop,TS val 1570341233 ecr 2900946405], length 0
12:35:22.391151 IP 10.0.0.10.43958 > 10.0.8.10.5201: Flags [.], seq 334526:337422, ack 1, win 83, options [nop,nop,TS val 2900946405 ecr 1570341187], length 2896
12:35:22.391165 IP 10.0.8.10.5201 > 10.0.0.10.43958: Flags [.], ack 337422, win 1092, options [nop,nop,TS val 1570341233 ecr 2900946405], length 0
12:35:22.391866 IP 10.0.0.10.43958 > 10.0.8.10.5201: Flags [P.], seq 337422:340318, ack 1, win 83, options [nop,nop,TS val 2900946406 ecr 1570341188], length 2896
12:35:22.391896 IP 10.0.8.10.5201 > 10.0.0.10.43958: Flags [.], ack 340318, win 1103, options [nop,nop,TS val 1570341233 ecr 2900946406], length 0
12:35:22.391942 IP 10.0.0.10.43958 > 10.0.8.10.5201: Flags [.], seq 340318:343214, ack 1, win 83, options [nop,nop,TS val 2900946406 ecr 1570341188], length 2896
12:35:22.391950 IP 10.0.8.10.5201 > 10.0.0.10.43958: Flags [.], ack 343214, win 1114, options [nop,nop,TS val 1570341233 ecr 2900946406], length 0
12:35:22.392942 IP 10.0.0.10.43958 > 10.0.8.10.5201: Flags [.], seq 343214:346110, ack 1, win 83, options [nop,nop,TS val 2900946406 ecr 1570341188], length 2896
12:35:22.392981 IP 10.0.8.10.5201 > 10.0.0.10.43958: Flags [.], ack 346110, win 1126, options [nop,nop,TS val 1570341234 ecr 2900946406], length 0
12:35:22.396026 IP 10.0.0.10.43958 > 10.0.8.10.5201: Flags [.], seq 346110:349006, ack 1, win 83, options [nop,nop,TS val 2900946408 ecr 1570341190], length 2896
12:35:22.396053 IP 10.0.8.10.5201 > 10.0.0.10.43958: Flags [.], ack 349006, win 1137, options [nop,nop,TS val 1570341238 ecr 2900946408], length 0
12:35:22.396153 IP 10.0.0.10.43958 > 10.0.8.10.5201: Flags [.], seq 349006:351902, ack 1, win 83, options [nop,nop,TS val 2900946408 ecr 1570341190], length 2896
12:35:22.396173 IP 10.0.8.10.5201 > 10.0.0.10.43958: Flags [.], ack 351902, win 1148, options [nop,nop,TS val 1570341238 ecr 2900946408], length 0
12:35:22.396545 IP 10.0.0.10.43958 > 10.0.8.10.5201: Flags [.], seq 351902:354798, ack 1, win 83, options [nop,nop,TS val 2900946408 ecr 1570341190], length 2896
12:35:22.396547 IP 10.0.0.10.43958 > 10.0.8.10.5201: Flags [.], seq 354798:357694, ack 1, win 83, options [nop,nop,TS val 2900946408 ecr 1570341190], length 2896
12:35:22.396564 IP 10.0.8.10.5201 > 10.0.0.10.43958: Flags [.], ack 354798, win 1160, options [nop,nop,TS val 1570341238 ecr 2900946408], length 0
12:35:22.396568 IP 10.0.8.10.5201 > 10.0.0.10.43958: Flags [.], ack 357694, win 1171, options [nop,nop,TS val 1570341238 ecr 2900946408], length 0
12:35:22.396913 IP 10.0.0.10.43958 > 10.0.8.10.5201: Flags [.], seq 357694:360590, ack 1, win 83, options [nop,nop,TS val 2900946410 ecr 1570341192], length 2896
12:35:22.396958 IP 10.0.0.10.43958 > 10.0.8.10.5201: Flags [.], seq 360590:362038, ack 1, win 83, options [nop,nop,TS val 2900946410 ecr 1570341192], length 1448
12:35:22.396968 IP 10.0.8.10.5201 > 10.0.0.10.43958: Flags [.], ack 360590, win 1182, options [nop,nop,TS val 1570341238 ecr 2900946410], length 0
12:35:22.396971 IP 10.0.8.10.5201 > 10.0.0.10.43958: Flags [.], ack 362038, win 1188, options [nop,nop,TS val 1570341238 ecr 2900946410], length 0
12:35:22.397558 IP 10.0.0.10.43958 > 10.0.8.10.5201: Flags [.], seq 362038:364934, ack 1, win 83, options [nop,nop,TS val 2900946410 ecr 1570341192], length 2896
12:35:22.397673 IP 10.0.0.10.43958 > 10.0.8.10.5201: Flags [.], seq 364934:367830, ack 1, win 83, options [nop,nop,TS val 2900946410 ecr 1570341192], length 2896
12:35:22.397697 IP 10.0.8.10.5201 > 10.0.0.10.43958: Flags [.], ack 364934, win 1199, options [nop,nop,TS val 1570341239 ecr 2900946410], length 0
12:35:22.397704 IP 10.0.8.10.5201 > 10.0.0.10.43958: Flags [.], ack 367830, win 1211, options [nop,nop,TS val 1570341239 ecr 2900946410], length 0
12:35:22.403207 IP 10.0.0.10.43958 > 10.0.8.10.5201: Flags [.], seq 367830:370726, ack 1, win 83, options [nop,nop,TS val 2900946421 ecr 1570341203], length 2896
12:35:22.403218 IP 10.0.8.10.5201 > 10.0.0.10.43958: Flags [.], ack 370726, win 1222, options [nop,nop,TS val 1570341245 ecr 2900946421], length 0
12:35:22.403756 IP 10.0.0.10.43958 > 10.0.8.10.5201: Flags [.], seq 370726:373622, ack 1, win 83, options [nop,nop,TS val 2900946422 ecr 1570341204], length 2896
12:35:22.403758 IP 10.0.0.10.43958 > 10.0.8.10.5201: Flags [.], seq 373622:376518, ack 1, win 83, options [nop,nop,TS val 2900946422 ecr 1570341204], length 2896
12:35:22.403790 IP 10.0.8.10.5201 > 10.0.0.10.43958: Flags [.], ack 373622, win 1233, options [nop,nop,TS val 1570341245 ecr 2900946422], length 0
12:35:22.403792 IP 10.0.8.10.5201 > 10.0.0.10.43958: Flags [.], ack 376518, win 1244, options [nop,nop,TS val 1570341245 ecr 2900946422], length 0
12:35:22.403929 IP 10.0.0.10.43958 > 10.0.8.10.5201: Flags [.], seq 376518:379414, ack 1, win 83, options [nop,nop,TS val 2900946423 ecr 1570341204], length 2896
12:35:22.403939 IP 10.0.8.10.5201 > 10.0.0.10.43958: Flags [.], ack 379414, win 1256, options [nop,nop,TS val 1570341245 ecr 2900946423], length 0
12:35:22.404054 IP 10.0.0.10.43958 > 10.0.8.10.5201: Flags [.], seq 379414:382310, ack 1, win 83, options [nop,nop,TS val 2900946423 ecr 1570341204], length 2896
12:35:22.404064 IP 10.0.8.10.5201 > 10.0.0.10.43958: Flags [.], ack 382310, win 1267, options [nop,nop,TS val 1570341246 ecr 2900946423], length 0
12:35:22.433059 IP 10.0.0.10.43958 > 10.0.8.10.5201: Flags [P.], seq 382310:383758, ack 1, win 83, options [nop,nop,TS val 2900946450 ecr 1570341232], length 1448
12:35:22.433109 IP 10.0.8.10.5201 > 10.0.0.10.43958: Flags [.], ack 383758, win 1273, options [nop,nop,TS val 1570341275 ecr 2900946450], length 0
12:35:22.433723 IP 10.0.0.10.43958 > 10.0.8.10.5201: Flags [.], seq 383758:386654, ack 1, win 83, options [nop,nop,TS val 2900946450 ecr 1570341232], length 2896
12:35:22.433725 IP 10.0.0.10.43958 > 10.0.8.10.5201: Flags [.], seq 386654:389550, ack 1, win 83, options [nop,nop,TS val 2900946451 ecr 1570341233], length 2896
12:35:22.433740 IP 10.0.8.10.5201 > 10.0.0.10.43958: Flags [.], ack 386654, win 1284, options [nop,nop,TS val 1570341275 ecr 2900946450], length 0
12:35:22.433744 IP 10.0.8.10.5201 > 10.0.0.10.43958: Flags [.], ack 389550, win 1295, options [nop,nop,TS val 1570341275 ecr 2900946451], length 0
12:35:22.434022 IP 10.0.0.10.43958 > 10.0.8.10.5201: Flags [.], seq 389550:392446, ack 1, win 83, options [nop,nop,TS val 2900946451 ecr 1570341233], length 2896
